0;Komponenten in Verbindung mit der Wirtschaft.
1;In der Bank-Komponente werden [Bank Accounts] erstellt und verwaltet. Bürger können mehrere Konten für sich erstellen und mit anderen Bürgern teilen. Konten können auch [Titles] und [Demographics] zugewiesen werden.
2;Kontobenutzer können Transaktionen über das Konto ausführen (Geld hinzufügen und entfernen).

Kontoverwalter können die Benutzer sowohl in der Verwalterliste als auch in der Benutzerliste ändern, das Konto umbenennen und Transaktionen ausführen. 

In den erweiterten Einstellungen kannst du das Konto als Regierungskonto festlegen. Regierungskonten können Steuergelder empfangen und auszahlen und werden bei der Steuererhebung und der Berechnung des persönlichen Vermögens ignoriert. Um dies einzustellen, musst du über staatliche Bankprivilegien verfügen, die durch einen [Elected Title|Elected Titles] zugewiesen werden.
3;Mit der Bank-Komponente können Konten erstellt und verwaltet werden
4;Mit der Anschlagsbrett-Komponente können Bürger [Contracts] und [Work Parties] veröffentlichen und akzeptieren, wodurch geltende Arbeits- und andere Vereinbarungen zwischen Bürgern ermöglicht werden.
5;Einen Vertrag Erstellen
6;
Wenn ein Vertrag veröffentlicht wird, kann er so viele oder so wenige Klauseln wie gewünscht haben, und jede Klausel kann so konfiguriert werden, dass sie den angeforderten Job beschreibt.  Jede Klausel muss erfüllt sein, bevor der Vertrag als vollständig angesehen wird.

Wenn Auto-Akzeptieren aktiviert ist, wird der Abschluss von Verträgen automatisch vom System erkannt.  Wenn ein Vertrag beispielsweise den Bau einer Straße zwischen zwei Punkten vorsieht, kann der Auftragnehmer, der die Arbeiten ausführt, den Vertrag in seinem Seitenmenü öffnen und auf Auftrag Beendet klicken, wodurch erkannt wird, ob der Auftrag tatsächlich abgeschlossen ist. Ist dies der Fall, wird der Vertrag entsprechend der Vereinbarung ausgezahlt und automatisch geschlossen.

Die 'Benutzerdefinierte Klausel' ist eine spezielle Klausel, die es dem Spieler erlaubt, in Worten zu beschreiben, was er gerne getan hätte. Wenn ein Vertrag eine solche Klausel enthält, muss er manuell vom Auftraggeber genehmigt werden (Auto-Akzeptieren darf nicht angehakt sein), da die Auto-Erkennung nicht feststellen kann, wann er fertig ist.
  
Wenn die automatische Erkennung nicht aktiviert ist, klickt der Auftragnehmer auf Auftrag Beendet, wenn er der Meinung ist, dass der Auftrag beendet ist, und der Auftragnehmer akzeptiert dann entweder die Fertigstellung oder lehnt sie ab.  Verträge ohne Auto-Akzeptanz erfordern mehr Vertrauen zwischen den Bürgern, da es keine Garantie gibt, dass der Auftragnehmer einen abgeschlossenen Auftrag ehrlich akzeptiert.  Den Bürgern wird empfohlen, [Reputation] als Mittel zur Bestimmung des Vertrauens in diesen Situationen zu verwenden.

Verträge haben eine festgelegte Zeitspanne, innerhalb derer sie abgeschlossen werden müssen, die bei der Veröffentlichung des Vertrags festgelegt wird. Außerdem können Verträge so eingestellt werden, dass sie sich bei wiederkehrenden Aufträgen wiederholen: wenn dies aktiviert ist, verringert sich der Wiederholungszähler jedes Mal, wenn ein Vertrag angenommen wird, um eins.

Jede für einen Vertrag angebotene Zahlung wird in einem speziellen Treuhandkonto  [Bank Account|Bank Accounts] gehalten, solange der Vertrag aktiv ist.  Wenn der Vertrag erfolgreich abgeschlossen wird, wird diese Zahlung an den Auftragnehmer überwiesen, und wenn er scheitert, wird sie an den Auftraggeber zurückerstattet.  Der Auftragnehmer kann auch eine Kaution erheben, die auf einem Treuhandkonto verwahrt und bei erfolgreichem Abschluss an den Auftragnehmer zurückerstattet oder bei Misserfolg an den Auftraggeber übergeben wird.
  
7;Arbeitsgruppen
8;
[Work Parties] können auch auf einem Anschlagsbrett gepostet werden. Dies ermöglicht die Erstellung von Aufgaben, die von mehreren anderen Bürgern erledigt werden können, im Gegensatz zu Verträgen, die nur eine Vereinbarung zwischen zwei Parteien sind. Bevor ein Bürger eine Arbeitsgruppe aushängt, muss er einen Arbeitsauftrag auf einem Handwerkstisch, den er besitzt, starten.

Nachdem er eine Arbeitsgruppe veröffentlicht hat, können Arbeiter dem Projekt auf dem Anschlagsbrett beitreten. Standardmäßig kann jeder der Arbeitsgruppe als Arbeiter beitreten, aber es können Anforderungen für einzelne Rollen oder allgemeine Anforderungen festgelegt werden, damit jeder beitreten kann. Wenn „Rollen Erweitern, Wenn Voll“ aktiviert ist, wird automatisch Platz für neue Arbeiter geschaffen, die dem Projekt beitreten können, wenn alle Rollen besetzt sind.

Beim Einstellen der gewünschten Arbeit kann die Person, die die Arbeitsgruppe ausgehängt hat, entscheiden, ob sie Arbeitskräfte, Ressourcen oder beides anheuern möchte. Jeder Bürger, der zur Arbeitsgruppe beiträgt, erhält einen Anteil an der Bezahlung, basierend auf der Menge der von ihm geleisteten Arbeit. Wenn einem bestimmten Job in einer Arbeitsgruppe zusätzliche Last zugewiesen wird, erhält dieser Job einen höheren Anteil an der Bezahlung.

9;
Es gibt eine Vielzahl von Zahlungsoptionen für eine Arbeitsgruppe, und es können mehrere Zahlungsoptionen für dieselbe Arbeitsgruppe angeboten werden.

- Wenn [Currency] als Zahlung angeboten wird, gibt es die „umlagefinanzierte“ Option, bei der die Arbeiter nach ihren Beiträgen ausbezahlt werden, anstatt einen Pauschalbetrag zu zahlen, wenn der Auftrag beendet ist.

- Wenn [Reputation] als Zahlung angeboten wird, wird sie durch alle Bürger geteilt, die beigetragen haben, wenn die Arbeitsgruppe fertig ist.

- Wenn [Research] als Bezahlung angeboten wird, werden alle Bürger, die den erforderlichen Betrag beisteuern, die Technologie sofort entdecken, wenn die Arbeitsgruppe fertig ist. Forschung kann nur als Bezahlung angeboten werden, wenn die Arbeitsgruppe ein Forschungsbuch erstellt oder wenn der Bürger, der das Angebot macht, das Forschungsbuch in seinem Inventar hat, wenn er den Job aushängt.

- Wenn ein [Title|Titles] als Bezahlung angeboten wird, muss der Bürger, der den Auftrag anbietet, ein Titelmanager für den angebotenen Titel sein. Alle Bürger, die den Mindestbetrag einzahlen, erhalten den neuen Titel. Der Zugriffstyp bestimmt, ob sie ein Titelmanager oder ein Titelnutzer werden.

10;Das Anschlagsbrett ermöglicht es Bürgern, Verträge und Angebote von Arbeitsgruppen zu veröffentlichen oder anzunehmen
11;Mit der Kredit-Komponente können Bürger die Währung und das Bankkonto für alle Transaktionen an einem Objekt, das sie besitzen, festlegen.  
12;
Bei der Auswahl von [Bank Accounts], können Bürger jedes Konto auswählen, auf das ihnen Zugriff gewährt wurde (durchgeführt in einer [Bank Component]). Standardmäßig wird das persönliche Konto des Bürgers ausgewählt.

Jede der [Currencies|Currency] der Welt kann in der Kredit-Komponente ausgewählt werden. Dies ist die Währung, die für alle Transaktionen verwendet wird, die für dieses Objekt stattfinden (z. B. akzeptiert ein [Store|Store Component] die hier festgelegte Währung).

Bei Auswahl von Keine für die Währung in einem Geschäft, sind direkte Geschäfte ohne die Notwendigkeit einer Währung möglich.

Objekte mit einer [Crafting Component] können eine Gebühr für berechtigte Bürger definieren, um sie zu nutzen. Die Einstellungen in der Kredit-Komponente bestimmen, in welcher Währung diese Gebühr erhoben wird und auf welches Konto das Geld eingezahlt wird.  
13;Mit der Kredit-Komponente können Bürger das Bankkonto und die Währung für Transaktionen an einem Objekt festlegen.
14;Mit der Urkundenverkauf-Komponente können Bürger [Property] kaufen und verkaufen.  
15;
Durch den Besuch eines [Real Estate Desk|Real Estate Desk Item], können Bürger Inserate für ihre Urkunden erstellen und die Inserate anderer Bürger anzeigen. Alle veröffentlichten Inserate können von jedem Immobilienschalter aus abgerufen werden.

Beim Erstellen eines Inserats legt der Eigentümer den Preis und die verwendete [Currency] fest. Alle Einnahmen gehen auf das ausgewählte [Bank Account|Bank Accounts].

Beim Kauf einer Urkunde wird die Währung vom dem vom Käufer ausgewählten Bankkonto abgebucht.

Nach dem Verkauf des Eigentums werden die Urkunde und alle in der Urkunde enthaltenen Gegenstände auf den neuen Eigentümer übertragen.  
16;Mit der Urkundenverkaufs-Komponente können Bürger Grundstücke kaufen und verkaufen.
17;Mit der Austausch-Komponente können Bürger eine [Currency] gegen eine andere tauschen.
18;Währung umtauschen
19;
Der Eigentümer eines [CurrencyExchangeItem] verwendet die Austausch-Komponente, um anderen Bürgern einen Währungsumtausch anzubieten. Beim Einrichten eines Austauschs ist die Eigentümerwährung die Währung, die zum Verkauf angeboten wird. Für jede Einheit der Eigentümerwährung, die gekauft wird, wird den Bürgern der festgelegte Betrag der Alternativwährung berechnet.

Wenn eine [Authorized Consumer|Authorization Component] die Wechselstube besucht, sieht er eine Liste aller angebotenen Austausche. Standardmäßig sind alle Bürger autorisierte Verbraucher.
20;Devisenbewirtschaftung
21;
Der Eigentümer der Wechselstube hat die Möglichkeit, Kontostandsbeschränkungen einzurichten. Diese verhindern, dass Bürger Geld umtauschen können, wenn der Währungsbetrag auf dem ausgewählten Konto nicht der Beschränkung entspricht.

Die Zahl links ist der minimale Währungsbestand und die Zahl rechts ist der maximale Währungsbestand. Wenn einer der Werte für die Kontostandsbeschränkung bei 0 bleibt, gibt es keine Begrenzung für diesen Teil der Kontostandsbeschränkung.
22;Ermöglicht es Bürgern, einen Geldumtausch einzurichten.
23;Die Gegenstandverteilungs-Komponente ermöglicht es dem Eigentümer, neuen Bürgern aus gutem Willen kostenlose Gegenstände zur Verfügung zu stellen und den anfänglichen Wohlstand der Bürger zu steigern.
24;
Alle neuen Bürger, die sich qualifizieren (basierend darauf, wie lange sie gespielt haben), können ihre Gegenstände über das [DistributionStationItem] sammeln. Beim Betreten der Welt beginnen neue Bürger mit einer globalen Kartenmarkierung, um sie darauf aufmerksam zu machen, dass die Gegenstände verfügbar sind. Beachte, dass die [Storage Component] mit den verteilten Artikeln gefüllt bleiben muss, damit neue Bürger sie abholen können.

Der Eigentümer kann festlegen, welche Artikel verteilt werden sollen, wie viele von jedem Artikel und wie kürzlich der Bürger der Welt beigetreten sein muss, um geeignet zu sein.  
25;Ermöglicht dem Eigentümer, neuen Bürgern aus gutem Willen kostenlose Gegenstände zur Verfügung zu stellen und den anfänglichen Wohlstand der Bürger zu steigern.
26;Mit der Münzstätte-Komponente können Bürger [Currencies|Currency] erstellen, die von einer Ressource unterstützt werden.

27;
Bei der Erstellung einer Währung an einem [MintItem] wird ein gestützter Gegenstand gewählt, sowie eine Menge an Münzen pro Gegenstand, die von jedem verbrauchten Gegenstand generiert werden.  Durch die Verwendung eines gestützten Gegenstands für die Währung, kann die mögliche Gesamtmenge der Währung auf die Anzahl der eingebrachten Gegenstände begrenzt werden, was für mehr Stabilität sorgt, da es schwieriger wird, den Markt mit neuer Währung zu überfluten.  Die Wahl des gestützten Gegenstandes beeinflusst dies, wobei seltenere Gegenstände in der Regel für mehr Stabilität sorgen, da sie schwieriger zu bekommen sind.

Das gestützte Material und die Münzen pro Gegenstand sind permanent, daher solltest du bei der Entscheidung, wie du eine Währung unterstützen willst, vorsichtig sein. Sobald eine Währung geprägt wurde, ist sie an die Prägeanstalt gebunden, in der sie hergestellt wurde, selbst wenn diese Prägeanstalt aufgekauft wird.

Bürger, denen in der [Authorization Component] Konsumrechte gewährt wurden, können die Münz-Komponente verwenden, um zusätzliche Währung zu prägen. Die Währung kann auf das vom Münzbesitzer ausgewählte Ziel [Bank Account|Bank Accounts] oder auf ein beliebiges Bankkonto geprägt werden, auf das der prägende Bürger in der [Bank Component] Zugriff hat.  
28;Ermöglicht es Bürgern, gedeckte Währungen zu erstellen und zu drucken.
29;
Mit der Laden-Komponente können Bürger Artikel festlegen, bei denen sie kaufen und an andere Bürger verkaufen möchten. Diese Aktionen können automatisch ausgeführt werden, ohne dass der Ladenbesitzer online sein muss.  
30;
Die Währung und das Bankkonto, die in der [Credit Component] ausgewählt wurden, werden für alle Transaktionen in dem Laden verwendet. Wenn Keine für die Währung in einem Geschäft ausgewählt wird, sind Direktgeschäfte möglich, die nicht der Umsatzsteuer unterliegen. 
 
Ein Ladenbesitzer kann bestimmte Container in der [Storage Component] verknüpfen, um auszuwählen, welche Artikel als Teil des Ladeninventars betrachtet werden. Standardmäßig werden alle in der Nähe befindlichen Lagercontainer mit dem Geschäft verknüpft, wenn es zum ersten Mal platziert wird.

Beim Erstellen einer Verkaufsliste muss nur der Preis festgelegt werden. Der Bestand für eine Verkaufsliste wird automatisch durch die Verfügbarkeit von Artikeln in den verknüpften Lagercontainern bestimmt.

Bei der Erstellung einer Einkaufsliste müssen der Preis und die Maximal zu Kaufende Menge für jeden Artikel festgelegt werden. Wenn die Maximal zu Kaufende Menge auf Null gesetzt wird, kauft das Geschäft so lange Artikel ein, bis die verknüpften Container voll sind. Wenn eine Maximal zu Kaufende Menge festgelegt wird, können Bürger diesen Artikel verkaufen, bis das verknüpfte Lager diese Menge enthält.

Für Werkzeuge mit Haltbarkeit kann eine Mindesthaltbarkeit zum Kaufen/Verkaufen festgelegt werden, und nur Gegenstände mit dieser Haltbarkeit oder höher können über den Laden gehandelt werden.
 
32;Stellt ein Interface für andere Bürger zur Verfügung, um automatisch Güter zu kaufen und zu verkaufen.
33;Komponenten in Verbindung mit der Regierung.
34;
Mit der Bürgerengagement-Komponente können Bürger an [Elections] teilnehmen, [Executive Actions] durchführen und aus dem Amt ausscheiden, je nachdem, welches Objekt verwendet wird.

35;An Wahlen teilnehmen
36;
Wenn der  Bürgerengagement-Komponente an einem [Ballot Box|Ballot Box Item] verwendet wird, können Bürger für [Elected Titles] kandidieren und an Wahlen teilnehmen. 

Durch das Klicken auf „Wählen“ werden die Spieler zur Webschnittstelle weitergeleitet, wo sie alle laufenden [Elections] sehen, sie mit ihren Mitbürgern diskutieren, ihre Argumente mit [Data] belegen und wählen können.  

Bürger, die im aktuellen [Election Process|Election Processes] ein Vetorecht erhalten haben, können eine Wahl sofort aufheben.

Um für gewählte Titel zu kandidieren, muss ein berechtigter Bürger zunächst „Wahl Starten“ verwenden. Sobald eine Wahl begonnen hat, können berechtigte Bürger die Aktion „Wahl Beitreten“ wählen, um dem Rennen beizutreten und eine Wahlkampfrede zu halten. Kandidaten können sich jederzeit von der Wahl zurückziehen, indem sie die auf einer Wahlurne verfügbare Option verwenden.

37;Exekutive Maßnahmen Ausführen
38;
Die Verwendung der Bürgerengagement-Komponente in einem [Executive Office|Executive Office Item] ermöglicht es einem gewählten Titel, einmalige Exekutivaktionen durchzuführen, die eine Reihe von Bürgern betreffen.

Die Bürgerbedingungen diktieren, für welche Bürger die Exekutivaktion gilt, und es können mehrere Bedingungen für die Qualität eines Bürgers festgelegt werden. Um eine Aktion für alle Bürger auszuführen, verwende die [Demographic] „Alle“ als Bürgerbedingung.

Die Aktion für jeden Bürger wird wirksam, sobald die Exekutivmaßnahme genehmigt ist. Für jeden Bürger, der die Bedingungen erfüllt, können mehrere Aktionen auf einmal ausgeführt werden.

39;Maßnahmen des Regierungsbüros
40;
Im [Government Office|Government Office Item] erlaubt die Bürgerengagement-Komponente gewählten Titeln, zurückzutreten oder andere gewählte Titel aus dem Amt zu entfernen.

Von Amt Zurücktreten ermöglicht es jedem gewählten Beamten, von seiner Stelle zurückzutreten. Wenn dem Gewählten Titel bei seiner Erstellung ein Nachfolgetitel zugewiesen wurde, wird ein neuer Beamter zufällig aus allen Bürgern ausgewählt, die diesen Titel innehaben; andernfalls wird der Gewählte Titel vakant.

Mit der Aktion Beamter aus dem Amt Entfernen können Bürger, denen die Befugnis erteilt wurde, gewählte Titel aus dem Amt entfernen. Es gelten die gleichen Regeln für die Suche nach einem Nachfolger, als ob der Beamte zurückgetreten wäre.

41;Erlaubt es Bürgern an Wahlen teilzunehmen und Exekutive Aktionen durchzuführen.
42;    Die Bürgerrecht-Komponente ermöglicht es den Bürgern, verschiedene Bürgerrechte vorzuschlagen, zu ändern und aufzuheben. 
43;Bürgerliche Aufgaben
44;Innerhalb einer Bürgerrecht-Komponente siehst du eine Liste deiner [Civic Duties]. Diese informiert den Bürger darüber, welche Berechtigungen er in Bezug auf Bürgerrechte hat, angesichts der aktuellen [Constitution]. Die Möglichkeiten der verschiedenen Bürgerpflichten sind:
45;Die Bürgerrecht-Komponente ermöglicht es den Bürgern, verschiedene Bürgerrechte vorzuschlagen, zu ändern und aufzuheben.
46;Die Registrar-Komponente ermöglicht die Erstellung und Verwaltung nicht gewählter [Titles]. Diese Titel können für viele der gleichen Zwecke wie [Elected Titles] verwendet werden, werden jedoch beim Registrar ernannt.
47;Titel zuweisen
48;Titelmanager können den Titel umbenennen und neue Manager und Titelträger zuweisen. Titelmanager gelten nicht als Titelbenutzer. Titelnutzer sind die Bürger, die als Titelträger gelten und alle damit verbundenen Vorteile und Bedingungen erhalten.
49;Erweiterte Einstellungen
50;
In den Erweiterten Einstellungen können Anforderungen für Titelverteidiger festgelegt werden, und den qualifizierten Titelverteidiger können Stundenlöhne zugewiesen werden.
  
Bei der Entscheidung, was von Amtsträgern Verlangt wird, können verschiedene Bedingungen festgelegt werden. Wenn ein Bürger diese Anforderungen nicht einhält, verliert er seine Zuweisung als Titelnutzer. Durch die Verwendung eines „Bedingungssatzes“ können mehrere Anforderungen für Titelverteidiger festgelegt werden.
 
Löhne werden an Titelnutzer von jedem [Bank Account|Bank Accounts] gezahlt, für das ein Titelmanager die Erlaubnis zur Verwendung in der [Bank Component] erhalten hat. Löhne werden stündlich (abhängig von den Welteinstellungen) auf das persönliche Konto jedes Titelnutzers gezahlt. Die Lohnart kann verwendet werden, um Offline-Stunden von Lohnzahlungen auszuschließen.
51;Erlaubt das Erstellen und Verwalten von nicht gewählten Titeln.
52;Mit der Staatskasse-Komponente können [Elected Titles], denen das Recht zum „Festlegen von Steuern bei der Staatskasse“ gewährt wurde, die Anpassung des Steuersatzes und die Auswahl der Weltstandardwährung.
53;Steuern
54;Nachdem [Taxes] in der Staatskasse-Komponente eingestellt sind, werden sie automatisch auf alle relevanten Transaktionen angewendet. Alle Einnahmen gehen in das [Bank Account|Bank Accounts] von der Staatskasse. Gewählte Titel, die die Einstellung „Bankenprivileg der Regierung“ haben, können direkt vom Staatskassenkonto transagieren (was die Auswahl des Kontos innerhalb der [Credit Component] ermöglicht). Geld kann auch über [Laws], die aus der Staatskasse kommen, die Zahlungen an Bürger vornehmen.
55;Standardwährung
56;Die Weltstandardwährung ist die Standard [Currency], die beim Platzieren eines neuen Objekts, das die Kreditkomponente enthält, verwendet wird. Bürger können immer noch eine beliebige Währung in einem [Trade] verwenden, aber mit einer Weltstandardwährung ist es einfacher, eine Wirtschaft mit einer gemeinsamen Währung aufzubauen.
57;Direkte Steuern
58;Gewählte Titel mit dem Recht „Steuern bei der Staatskasse festlegen“ können direkt von den Bürgern Steuern erheben oder Gelder zuweisen. Dies geschieht durch die Verwaltung der gewünschten Währung und die Auswahl der Bürger, für die die Aktion gelten soll. Ein gewählter Titel muss immer einen Grund angeben, warum er diese Aktion durchführt, der für alle Bürger angezeigt wird.
	  
Die Verwaltung der Staatskasse beinhaltet auch die Option, die Währung aus dem Konto der Staatskasse zu entfernen. Dadurch wird die Währung dauerhaft entfernt. Sei also vorsichtig, wenn du diese Fähigkeit für gestützte Währungen verwendest.  
59; Erlaubt Bürgern, die einen Gewählten Titel mit Steuerberechtigung besitzen, Steuern festzulegen und die Weltstandardwährung auszuwählen.
60;Wohnbezogene Komponenten.
61;Die Autorisierungs-Komponente ermöglicht es anzugeben, welche Berechtigungen Bürger für das Objekt haben.    
62;
Die hier angezeigte Urkunde ist einfach eine Verbindung zur Urkunde des [Property], auf dem sich das Objekt befindet (oder der Urkunde, die mit der [Vehicle|Vehicle Component] verbunden ist, wenn es eine ist).

Autorisierte Verbraucher können hier aufgeführt werden, entweder als bestimmte Personen,  [Titles] oder [Demographics]. Jeder Aufgeführte kann mit dem Objekt interagieren, ohne die volle Kontrolle zu haben.  Ein Geschäft zum Beispiel erlaubt Bürgern mit Verbraucherrechten, dort zu kaufen und zu verkaufen, aber nur Bürger mit vollen Rechten auf das Grundstück können ändern, was zum Verkauf steht, oder das Geschäft selbst verschieben.

Alle platzierten Objekte haben Berechtigungs-Komponenten.  
63;Ermöglicht den Bürgern, die Zugriffsrechte für ein bestimmtes Objekt festzulegen.
64;Betten erlauben es Bürgern, die Zeit zu beschleunigen, wenn alle Bürger sie gleichzeitig verwenden oder offline sind.  
  
(Diese Funktion ist auf dedizierten Servern standardmäßig deaktiviert, um zu verhindern, dass die Zeit beschleunigt wird, wenn alle Benutzer offline sind. Sie kann jedoch von einem Serveradministrator aktiviert werden.)
65;Ermöglicht das Schlafen in Einzelspieler-Servern oder Servern, bei denen das Schlafen aktiviert ist.
66;Komponenten in Verbindung mit der Industrie.
67;
    Der Herstellungs-Komponente wird verwendet, um Gegenstände zu [Craft|Crafting], Ressourcen oder Arbeit hinzuzufügen und bestehende Projekte abzubrechen. Wenn zu einer [Work Party|Work Parties] beigetragen wird, können Bürger, die der Arbeitsgruppe beigetreten sind, auf die Herstellungs-Komponente zugreifen.
  
68;Gegenstände Herstellen
69;
Nach der Auswahl eines Gegenstands und der Menge, die hergestellt werden soll, werden Ressourcen und Arbeitskräfte benötigt, um das Projekt zu starten. Diese Ressourcen können manuell hinzugefügt werden (indem man sie direkt auf dem Handwerkstisch platziert) oder durch die Verknüpfung einer [Storage Component], die sie enthält.

Bürger mit einer verwandten [Specialty|Specialties] benötigen weniger Kalorien, um Arbeit hinzuzufügen. Einige Projekte erfordern Fachkräfte von einem Bürger mit der entsprechenden Spezialität. Diese Verringerung wird nach dem Start des Arbeitsauftrags angewendet, damit Bürger mit unterschiedlichen Fertigkeitsstufen zur selben Arbeitsgruppe beitragen können.

Durch Hinzufügen einer Aufrüstung in der [Modules Component] haben Arbeitsaufträge auf einem Handwerkstisch weniger Herstellungszeit und Ressourcenkosten.

Wenn ein Projekt vorzeitig abgebrochen wird (durch Rechtsklick auf den Auftrag), werden die Ressourcen zurückerstattet, aber die aufgewendete Arbeit geht verloren.  
70;Arbeit Hinzufügen
71;
Für jede Arbeitseinheit, die benötigt wird, werden [Calories|Nutrition] verbraucht. Nachdem ein Arbeitsauftrag gestartet wurde, können Bürger Arbeit hinzufügen, indem sie die Schaltfläche „Arbeit“ in der Herstellungs-Komponente drücken. 

Sobald ein Projekt gestartet ist, können Arbeitskräfte schnell von außerhalb der Herstellungs-Komponente hinzugefügt werden, indem mit der rechten Maustaste auf einen Handwerkstisch geklickt wird. Wenn beim Hinzufügen von Arbeit auf diese Weise die Taste „Strg“ gedrückt gehalten wird, wird die fünffache Menge der normalen Arbeit hinzugefügt. Wenn die „Alt“-Taste gedrückt gehalten wird, werden alle verfügbaren Kalorien hinzugefügt.  
72;Etikettierte Zutaten
73;
Einige Rezepte verwenden Etikettierte Zutaten, die ähnliche Elemente als Eingaben akzeptieren können. Ein Element kann beispielsweise angeben, dass es Stein benötigt, und akzeptiert alle Arten von Gestein mit diesem Etikett ([GraniteItem], [BasaltItem] usw.).

Etikettierte Zutaten werden automatisch konsumiert, sodass keine separaten Aufträge mit den verschiedenen Zutaten erstellt werden müssen.  
74;Mutterrezepte
75;
Einige Rezepte sind Teil einer größeren Gruppe von Rezepten, die als Mutterrezepte bezeichnet werden. Bei der Herstellung eines dieser Rezepte kann ein Bürger eine bestimmte Variante für die Herstellung auswählen. Die hergestellte Zahl ist die Menge, die für das Mutterrezept ausgewählt wurde.

Standardmäßig werden nur Rezepte angezeigt, die über verfügbare Ressourcen verfügen. Wenn du „Alle Anzeigen“ aktivierst, werden alle möglichen Variationen angezeigt.  
76;Die Herstellungs-Komponente wird verwendet, um Gegenstände herzustellen und Arbeitskraft zu Projekten hinzuzufügen.
77; Mit der Modul-Komponente können Bürger Aufrüstungen in ihre [Crafting] tische einfügen. Nach dem Einfügen einer Aufrüstung reduzieren Arbeitsaufträge an diesem Tisch die Ressourcenkosten und die Herstellungszeiten.
78;Aktualisierungen benutzen
79;
Aufrüstungen gibt es in fünf verschiedenen Qualitätsstufen. Eine Aufrüstung der Stufe 1 verringert die Ressourcenkosten und die Herstellungszeit um 10 %, wobei jede weitere Stufe eine zusätzliche Verringerung bedeutet.

