Handwerkstische akzeptieren unterschiedliche Arten von Aufrüstungen. Frühe Tische akzeptieren „Basis-Aufrüstungen“, während spätere Tische „Erweiterte Aufrüstungen“ oder „Moderne Aufrüstungen“ erfordern. Jede Stufe von Aufrüstungen hat fünf verschiedene Qualitätsstufen, wobei die höchste Qualitätsstufe eine Spezialitäten-Aufrüstung ist.

Einige Rezepte haben Kosten, die Statische Zutaten verwenden. Statische Zutaten sind von der Ressourcenkostenreduzierung nicht betroffen, aber die Rezepte, die sie enthalten, erhalten trotzdem eine Reduzierung für die Herstellungszeit.  
		
80;Spezialisierungs-Upgrades
81;
Die höchste Stufe der Aufrüstung kann nur von einem Bürger hergestellt werden, der die maximale Stufe in seiner gewählten [Specialty|Specialties] erreicht hat. Im Gegensatz zu anderen Aufrüstungen geben diese Aufrüstungen eine zusätzliche Kostenreduzierung beim Herstellen von Rezepten mit dem angegebenen Beruf.

Einige Spezialisierungen verfügen über verschiedene Arten von Aufrüstungen, die verschiedenen Handwerkstischen entsprechen. Zum Beispiel, [CarpentrySkill] hat [CarpentryBasicUpgradeItem] für den [CarpentryTableItem] und den [CarpentryAdvancedUpgradeItem] für die [SawmillItem].
  
82;Ermöglicht es den Bürgern ihre Handwerkstische aufzurüsten.
83;
Mit der Rohr-Komponente kann ein Bürger den Status des Smogausstoßes, des Wasserverbrauchs und des Abwasserflusses eines Objekts überprüfen.  
84;Smogausstoß
85;
Durch Überprüfen von dem Smog-Ausstoß Tooltip kann ein Bürger zusätzliche Informationen über den Verschmutzungsausstoß des aktuellen Objekts und die [Pollution] -Werte der Welt finden.
	
Rohre können verwendet werden, um den Fluss der Luftverschmutzung umzuleiten. Die Rohre, die den Smog-Ausstoß enthalten, können mehrere Eingänge haben, dürfen aber nur ein offenes Ende haben, das sich außerhalb aller Räume und oberhalb des Objekts befindet.

Objekte, die Smog-Verschmutzung ausstoßen, verschmutzen nur, wenn das Objekt aktiv ist. 
	
86;Wasser und Abwasser
87;
Objekte mit einem Wassereingang und Pumpen mit einem Wasserausgang sind durch ein Rohrsystem verbunden. Wasserrohrsysteme können mehrere Eingänge für Wasserpumpen und mehrere Ausgänge für jedes Objekt mit einem Wasserbedarf haben.	

Durch Überprüfen des Wasser-Tooltips in der Rohr-Komponente kann ein Bürger genau sehen, wie viel Wasser ein Objekt produziert oder verbraucht. Wenn nicht genügend Wasser produziert wird, werden die Objekte inaktiv.

Rohre, die Abwasser produzieren, funktionieren ähnlich wie Wasserrohre, aber das [Sewage], das sie enthalten, ist eine Quelle der Bodenverschmutzung. Nachdem [Waste Filters|Waste Filter Item] erfunden wurden, kann der Abwasserausgang in einen Filter geleitet werden, um die Bodenverschmutzung zu mindern. 
	
88;Die Rohr-Komponente ermöglicht es einem Bürger, den Status des Smogausstoßes und des Wasserverbrauchs eines Objekts zu überprüfen.
89;Der Strom-Komponente wird verwendet, um den Status des lokalen Stromnetzes zu überprüfen. Er wird auch verwendet, um den Verbrauch von Objekten zu prüfen, die zum Betrieb Kraftstoff benötigen.
90;Kraftstoff
91;
Objekte, die Kraftstoff verbrauchen, können hier einen Brennstoffeinsatz haben, und für den Betrieb sind möglicherweise unterschiedliche Kraftstoffarten erforderlich. Die Tooltips für den aufgenommenen Kraftstoff enthalten eine Liste bestimmter Gegenstände, mit denen das Objekt betankt werden kann. Kraftstoff kann auch über die [Storage Component] hinzugefügt werden.

Während des Betriebs verbraucht ein Objekt jede Sekunde Kraftstoff, gemessen in Watt (W). Jede Kraftstoffart enthält eine andere Menge an potenzieller Energie, gemessen in Joule (J). Für 1 Watt pro Sekunde wird 1 Joule Energie verbraucht. Während das Objekt inaktiv ist, wird kein Kraftstoff verbraucht.  
92;Energiebilanz
93;
Es gibt zwei Arten von [Power], die von einem Objekt verwendet werden können: Elektrisch und Mechanisch. Das Stromnetz zeigt den Typ und die Verfügbarkeit des für dieses Objekt benötigten Stroms an. Wenn nicht genügend Strom vorhanden ist, um die benötigte Leistung zu erreichen, werden Objekte inaktiv.

Stromerzeuger, die Kraftstoff verbrauchen, werden inaktiv, wenn sich keine Objekte in der Nähe befinden, die Strom benötigen. Sie müssen nicht ein- und ausgeschaltet werden, um Kraftstoff zu sparen.  
94;Der Strom-Komponente dient zur Überprüfung von Versorgung und Bedarf an Strom und Kraftstoff.
95;Die Reparatur-Komponente ermöglicht es den Bürgern, Werkzeuge an einem [ToolBenchItem] zu reparieren.
96;
Nach dem Einsetzen eines defekten Werkzeugs werden die Reparaturkosten angezeigt. Erweiterte Werkzeuge können von Bürgern mit den entsprechenden [Specialty|Specialties] für weniger Ressourcen repariert werden. Die verwendeten Ressourcen können von einem Bürger manuell hinzugefügt oder aus einem verknüpften Container in der [Storage Component] entnommen werden.

Der Besitzer einer Werkzeugbank kann anderen Bürgern gegen eine in der [Credit Component] festgelegte Gebühr den Zugang zur Reparatur ihrer eigenen Werkzeuge ermöglichen. Wenn der Öffentlichkeit Werkzeugreparaturen angeboten werden, müssen die Verbraucherrechte in der [Authorization Component] angegeben werden.  
97;Ermöglicht Bürgern Werkzeuge zu reparieren.
98;
Mit der Status-Komponente können Bürger sehen, welche Anforderungen für ein Objekt aktiv sein müssen, und welche dieser Anforderungen erfüllt sind. Wenn ein Objekt [Pollution] verursacht, zeigt die Status-Komponente auch die lebenslange Verschmutzungsproduktion für dieses Objekt an.
99;Objektstatus
100;
Jede Bedingung in der Status-Komponente muss erfüllt sein, bevor ein Objekt aktiv sein kann. Einige Beispiele für Bedingungen sind:

- In einem gültigen [Room|Rooms] enthalten sein

- Genug [Power] haben

- Ein funktionierendes [Sewage]-System
101;Statusanzeige
102;
Bei der Interaktion mit einem Objekt mit einer Status-Komponente, können Bürger den Status des Objekts schnell anzeigen, indem sie die Statusanzeige in der oberen linken Ecke aktivieren. Ein grüner Kreis bedeutet, dass ein Objekt aktiv ist, während ein roter Kreis bedeutet, dass es inaktiv ist.
103;Zeigt an, ob ein Objekt aktiv oder inaktiv ist und warum.
104;Der Lager-Komponente dient dazu, den Bestand von Lagercontainern zu verwalten und sie mit Objekten zu verknüpfen, die Lagerplatz benötigen.
  
105;Lager Verwalten
106;
Das Inventar kann zwischen Containern verschoben werden, indem Stapel von Gegenständen von einem Container in einen anderen gezogen werden.

Wenn du beim Ziehen von Gegenständen die Umschalttaste gedrückt hältst, werden alle Stapel desselben Gegenstands zwischen den Containern verschoben. Wenn du mit der rechten Maustaste auf einen Stapel von Gegenständen klickst, kann der Spieler den Stapel in kleinere Mengen unterteilen. Wenn du beim Klicken auf einen Stapel von Gegenständen die Strg-Taste gedrückt hältst, wird der Stapel in zwei Hälften geteilt.

Einige Lagercontainer, wie z. B. ein [StockpileItem], können jede Art von Gegenstand enthalten. Andere Lagercontainer, wie z. B. ein [StorageChestItem], können nur nicht transportierbare Elemente enthalten.  
107;Verknüpfung von Lagercontainer
108;
Ein Objekt kann mit Containern in der Speicher-Komponente verknüpft werden, indem das Kontrollkästchen für den Container aktiviert wird. Nach der Verknüpfung erhält das Objekt Zugriff auf alle Elemente in den Containern und kann den Container zur Lagerung verwenden. Beim Verknüpfen von Lagercontainern wird zuerst der oberste Container in der Speicher-Komponente für die Lagerung verwendet. Die Reihenfolge kann durch Klicken und Ziehen auf die Lageranzeigen in der Liste geändert werden.  
109;Verwaltet das Inventar und ermöglicht die Verknüpfung der Lagerung mit anderen Objekten.
110;Eine vom Handel florierende Wirtschaft ist entscheidend für die Entwicklung der Technologie, die zum Stoppen des Meteors erforderlich ist.
111;Bankkonten sind Speicher von [Currency], auf die ein oder mehrere Bürger zugreifen können.  Jeder Bürger betritt die Welt mit einem permanenten persönlichen Bankkonto, das eine unendliche Menge seines Persönlichen Kredites enthält. Zusätzliche Bankkonten können gewährt und ihre Zugriffsrechte an einer [Bank|bank component] angepasst werden.

Bankkonten sind nützlich, um Währungen zu organisieren, mehreren Parteien den Zugriff auf Gelder zu ermöglichen und die Erhebung von Steuern zu speichern und festzulegen, wer darauf zugreifen darf. Regierungen richten in der Regel eine Reihe von Bankkonten ein, um den Steuerzufluss zu verwalten und sicherzustellen, dass die Mittel wie vorgesehen verwendet werden.  Jedes Bankkonto kann unbegrenzte Beträge in unbegrenzten Währungen enthalten, wobei jede Währung separat verfolgt wird. Durch Klicken auf das Bankkonto, wird das Hauptbuch angezeigt, das alle Transaktionen auf oder von diesem Konto auflistet, da alle Transaktionen in Eco öffentlich sind.

112;Bankkonten dienen als Lagerung und Trennung von Währungen für verschiedene Zwecke durch verschiedene Bürger und staatliche Stellen.
113;
Ein Vertrag ist eine Vereinbarung zwischen zwei Bürgern, die in einer [Contract Board|contract board component] erstellt wurde. Die Vereinbarung kann eine beliebige Anzahl von Klauseln enthalten und Kombinationen von auszuführenden Arbeiten und zu zahlenden Entschädigungen festlegen. Sie wird vom Kundenbürger veröffentlicht und kann von jedem rechtskräftigen Bürger asynchron akzeptiert werden.
114;Beispiele für Verträge sind:
    - Eine Straße zwischen zwei bestimmten Punkten anlegen.
    - Geld zwischen zwei Parteien mit einem gegebenen Zinssatz und Fälligkeitsdatum leihen.
    - Einen Raum mit gegebenen Anforderungen an einem bestimmten Ort bauen.
    - Benutzerdefinierte Anforderungen, die in einem Text beschrieben und nach Fertigstellung vom Kunden akzeptiert/abgelehnt werden.
  
115;Verträge halten eine Vereinbarung zwischen zwei Bürgern aufrecht.
116;
Mit der Herstellung kann man neue Produkte aus Zutaten, Arbeit und/oder Energie erstellen. Die Herstellung kann auch Nebenprodukte erzeugen, die Umweltverschmutzung verursachen und die Umwelt negativ beeinflussen.  Sie bildet das Rückgrat der Wirtschaft und erzeugt Nachfrage nach Ressourcen, die aus dem Ökosystem um sie herum stammen, sowie Nachfrage nach individueller Facharbeit und geteilten Dienstleistungen wie [Power|Power Component] oder [Sewage].

Jeder Tisch, der eine [Crafting Component] besitzt, kann in einer Liste definierte Produkte herstellen. Handwerkstische können gemeinsam genutzt werden, wobei jeder eine konfigurierbare [Authorization Component] hat, die festlegt, wer darauf zugreifen darf, und in der [Credit Component] des Tisches können Gebühren festgelegt werden, um mit der gemeinsamen Nutzung deines Tisches Geld zu verdienen.

Die Inputs und Outputs können entweder direkt vom Handwerkstisch genommen oder in einer angeschlossenen [Storage Component] platziert werden.  Das Ablegen von Zutaten und Produkten im Lager ermöglicht es den Bürgern, große Aufträge in die Warteschlange zu stellen, die automatisch ablaufen. 

Viele Rezepte erfordern die Arbeit eines bestimmten [Skill|skills overview].  Während jeder Bürger ein Herstellungsrezept starten oder Zutaten hinzufügen kann, kann nur ein Bürger mit den erforderlichen Fertigkeiten Arbeit dazu beitragen.  Um eine Gruppe zu bilden und viele Bürger zu einem Arbeitsauftrag beitragen zu lassen, während sie sich die Bezahlung teilen, können [Work Parties] erstellt werden.
  
117;Bürger können mit der Herstellung Produkten an bestimmten Tischen erschaffen.
118;Währungen sind ein Mittel zur Erleichterung des Handels als Repräsentation des Wertes. Ihr Wert hängt ganz davon ab, wie sie verwendet werden.

Bei Eco gibt es zwei Arten von Währungen: gestützt und nicht gestützt.
  
Eine nicht gestützte Währung ist eine ungedeckte Währung, und jeder Spieler beginnt mit seiner eigenen persönlichen Währung mit einem unendlichen Betrag. Diese sind besonders im frühen Spiel nützlich, wenn keine globale Währung festgelegt ist. Diese Währungen erfordern jedoch viel Vertrauen, dass der Eigentümer ihren Wert nicht manipuliert, da sie einen unbegrenzten Betrag haben und eine Wirtschaft, die sie nutzt, leicht destabilisieren können.
  
Gestützte Währungen sind viel stabiler. Eine gestützte Währung wird an einer [Mint|Mint Component] erstellt, indem ein Währungsunterstützendes Material in Münzen umgewandelt wird. Mehr Währung kann nur durch den Erwerb von mehr Material geschaffen werden. Dies bietet eine viel stärkere Begrenzung der Währungsbeträge, die in die Welt eingeführt werden können, und bildet eine stärkere Grundlage für den globalen Handel. Oft entscheidet sich eine Welt dafür, von einer Sammlung persönlicher Währungen zu einer oder mehreren gestützten Währungen zu wechseln, wenn die Wirtschaft im Laufe des Spiels wächst und mehr globaler Handel und Zusammenarbeit erforderlich sind.
  
Währungen können in der Wirtschaftsanzeige sowie über [Trade] auf andere Währungen übertragen werden. Alle Währungen werden auf einem [Bank Account|Bank Accounts] gespeichert.

119;Währung ist ein gesellschaftliches Konstrukt, das den Handel erleichtert.
120;Die Wirtschaft hat häufig nichts mit dem ausgegebenen Geld zu tun, sondern mit der Weisheit, mit der sie ausgegeben wird.
     Henry Ford  
121;Die Wirtschaft umfasst die Handlungen der Ernte, Produktion und des Handels zwischen Bürgern, die sich aus der [Ecosystem|Ecosystem Overview] gemäß der Verordnung der [Government|Government Overview] ergeben. Die Bürger müssen für eine reibungslose Wirtschaft sorgen, um die Technologie so weit voranzutreiben, dass der Meteor gestoppt wird, ohne dass er Amok läuft und den Planeten durch Verschmutzung zerstört.  
122;Wirtschaftskonzepte
123;
  - [Crafting]. Verwendung industrieller Werkzeuge zur Herstellung neuer Waren.
  - [Trade]. Warenaustausch von Personen mit unterschiedlichen Fachgebieten oder Zugang zu Ressourcen.
   - [Transport]. Bewegen von Ressourcen von Ort zu Ort und Aufbau einer weltweiten Infrastruktur, um dies zu tun.
  - [Research]. Förderung des menschlichen Wissens zur Verbesserung der Gesellschaft.
  - [Currency]. Eine von den Bürgern geschaffene Wertrepräsentation, die die Wirtschaftstätigkeit erleichtert.
  - [Work Parties]. Organisierte Arbeitsgruppen, die Belohnungen teilen.
  - [Contracts]. Vereinbarungen zwischen zwei Bürgern über Arbeit oder andere Vereinbarungen.
  - [Bank Accounts]. Währungsbehälter mit konfigurierbarem Zugang.
  - [Finance].  Bereitstellung von Kapital für andere Bürger, um ihnen zu helfen, Fortschritte zu erzielen und gleichzeitig selbst Gewinne zu erzielen.  
124;Die Wirtschaft besteht aus dem gesamten Ressourcenverbrauch, dem Handel und dem technologischen Fortschritt der Bürger.
125;Durch die Verwendung von [Contracts] können Bürger in Eco Darlehens- und Anleiheverträge zwischen zwei Parteien erstellen und dabei automatisch die Zinszahlung und das Fälligkeitsdatum der Mittel verfolgen.  Darlehen und Anleihen sind eine großartige Möglichkeit für neue Bürger, mit langjährigen Bürgern mit mehr Reichtum auf eine Weise zusammenzuarbeiten, die beiden Parteien zugutekommt und den gesellschaftlichen Fortschritt erhöht.

Wenn ein Bürger einen Kredit aufnimmt, gibt ihm die anbietende Partei Geld, von dem er erwartet, dass er es mit Zinsen zurückzahlt.
Wenn ein Bürger eine Anleihe kauft, gibt er der anbietenden Partei Geld, von dem er erwartet, dass es mit Zinsen zurückgezahlt wird.

Strafen für die Nichteinhaltung von Krediten können mit [Laws] konstruiert werden, indem man auf den Zahlungsverzug von dem Auslöser Darlehen/Anleihen achtet.  Es können dann Maßnahmen ergriffen werden, wie z. B. die Wiederinbesitznahme von Eigentum oder die Anwendung anderer Strafen und Bußgelder.

126;Finanzen ist die Verwaltung von Geld, um den Fortschritt zu fördern.
127;Jeder Spieler kann den Ruf eines anderen Spielers beeinflussen, was wiederum als Faktor in Gesetzen, Verträgen usw. verwendet werden kann, die den Ruf eines Bürgers abfragen und Privilegien (oder deren Fehlen) basierend auf dem Wert bestimmen. Um den Ruf eines Bürgers einzustellen, bewege den Mauszeiger über seinen Namen im Chat und klicke auf den Rufeintrag im Tooltip (eine Liste aller Bürger findest du auf der Seite  [Current Citizens]).

128;Der Ruf wird durch einen Netzwerkmultiplikator modifiziert, der als +1 für jeden Bürger berechnet wird, der dir einen guten Ruf gibt, und -1 für jeden Bürger, der dir einen negativen Ruf gibt.  Auf diese Weise wird es vorteilhafter, vielen Bürgern zu helfen und einen weit verbreiteten Ruf zu erlangen, als sich nur auf einige wenige Bürger zu konzentrieren.  Relativer Ruf ist ein weiterer Wert, der nur die Bürger berücksichtigt, denen du einen positiven Ruf gegeben hast.

129;Ein Wert, der von anderen Bürgern oder von Gesetzen festgelegt wird und deinen sozialen Status darstellt.
130;Forschung schafft neues, gemeinsam nutzbares Wissen, das neue Arten von Produkten und Fähigkeiten freischaltet.  Sie wird an einem [ResearchTableItem] durchgeführt, wo du ein Fertigkeitsbuch herstellst.  Einmal erstellt, kann ein Fertigkeitsbuch verwendet werden, um eine unbegrenzte Anzahl von Fertigkeitsschriftrollen zu erstellen, die die Spezialität für einen Bürger freischalten, der eine verwendet.

Jede Schriftrolle ist ein einmalig verwendbares Verbrauchsmaterial, das bei demjenigen, der sie benutzt, eine neue [Specialty|specialties]  freischaltet, die dann mit einem Level-Up durch das [Skills|skills overview]-System beansprucht werden muss.  Der Erwerb einer neuen Fertigkeitsschriftrolle gewährt dem Bürger auch den Vorteil eines Satzes von [Property Claim Papers|Property], der es ihm erlaubt, mehr Land zu beanspruchen, während er an Fertigkeit gewinnt.
    
Fertigkeitsbücher gehören zu den am schwierigsten herzustellenden Gegenständen, und die Bürger müssen in der Regel zusammenarbeiten, um die verschiedenen Ressourcen und Arbeitskräfte zu beschaffen, die für ihre Herstellung erforderlich sind.  Daher eignen sich Forschungsprojekte besonders gut für [Work Parties], da die Bürger sie nutzen können, um die Arbeit, die zur Erstellung benötigt wird, zusammen mit der Wissensbelohnung nach Fertigstellung zu teilen.  
131;Forschung schafft neues, gemeinsam nutzbares Wissen, das neue Arten von Produkten und Fähigkeiten freischaltet.
132;Der Handel mit deinen Mitbürgern ist für Eco von entscheidender Bedeutung, da jeder Spieler eine Reihe von [Specialties] hat, zu denen er am effektivsten beitragen kann, während er mit anderen Bürgern handelt, die in Berufen ausgebildet sind, in denen er nicht ausgebildet ist. 

 - Der Handel kann in einem [Store Component] eingerichtet werden, in dem Kauf- und Verkaufspreise für die verschiedenen gewünschten Waren aufgelistet werden. Die Bürger können dann asynchron Waren kaufen und verkaufen, ohne anwesend zu sein.
 - Der Handel von Arbeitskraft kann über [Contracts] und [Work Parties] erfolgen, sodass die Spieler ihre Arbeit gegen Bezahlung nach vereinbarten Bedingungen ausführen können. Dies kann auch asynchron erfolgen.
 - Der Handel mit Währungen kann an einer [Currency Exchange|Exchange Component] durchgeführt werden, die Kauf-/Verkaufspreise für den Tausch verschiedener Währungen auflistet.
 - Der Handel wird durch [Transport] erleichtert, und der Aufbau einer Transportinfrastruktur zwischen den aufkeimenden Knotenpunkten der Zivilisation fördert die Handelsfähigkeit erheblich.
 - Der Handel unterliegt [Taxes], festgelegt von der [government overview], die den Wert bestimmter Handelsgeschäfte entweder fördern oder bremsen kann.

133;Der Handel zwischen Bürgern mit unterschiedlichen Fähigkeiten und unterschiedlichen Gütern ist das Rückgrat der Wirtschaft.
134;Da die Ressourcen auf der ganzen Welt verteilt sind und die Orte, an denen sie gesammelt und verarbeitet werden, sich von denen unterscheiden, an denen sie verwendet werden, wird der Transport zu einem entscheidenden Erfolgsfaktor in Eco.

Um Materialien effizient zu verarbeiten, musst du Fahrzeuge erstellen, um sie zu transportieren, und dafür muss der Boden zu Straßen planiert werden. Mit einem [StoneRoadToolItem] kannst du den Boden planieren und für Fahrzeuge nutzbar machen. Mit Rampen kannst du leichte Hänge erstellen, auf denen Fahrzeuge fahren können. Fortgeschrittenere Fahrzeuge erfordern fortgeschrittene Straßen, um effizient zu fahren, und Straßen müssen regelmäßig aktualisiert werden, sobald neue Technologien verfügbar sind.

Der Bau von Straßen zwischen Dörfern und Ressourcenspeichern wird Zeit und Mühe vieler Bürger erfordern und ist ein guter Kandidat für öffentliche Bauprojekte, die von [Taxes] finanziert und von [Work Parties] gebaut werden. Mit dem technologischen Fortschritt der Welt wird immer mehr Verkehrsinfrastruktur geschaffen, die den Handelsfluss unterstützt, und schließlich bis zu einem Punkt wachsen, an dem der Straßenbau und die Fahrzeugnutzung Auswirkungen auf die Umwelt haben werden. Ein sorgfältiges Management dieses Einflusses ist der Schlüssel zum Erhalt der Ökosysteme, die sie durchlaufen.

135;Da die Ressourcen und ihre Nutzung über die ganze Welt verteilt sind, wird eine Umgestaltung der Welt durch den Bau von Transportinfrastrukturen notwendig.
136;Eine Arbeitsgruppe ist ein Vertrag zwischen mehreren Bürgern um eine Arbeit gemeinsam zu verrichten. Sie beginnt mit einem Bürger, der am [Contract Board|Contract Board Component] einen Arbeitsauftrag angelegt hat.

Der Bürger, welcher die Arbeitsgruppe anlegt, kann die verschiedenen Parameter der Arbeit festlegen. Dies umfasst:
 - Erfüllen des Arbeitsauftrags
 - Voraussetzungen um der Arbeitsgruppe beizutreten.
 - Art und Weise wie Teilnehmer der Arbeitsgruppe bezahlt werden.
 - Wie die Bezahlung verteilt wird.

Arbeitsgruppen sind besonders praktisch um [Research] durchzuführen. Ein Bürger kann ein Forschungsprojekt, welches viele Ressourcen kostet, einer Arbeitsgruppe zuweisen. Bürger können automatisch einer Arbeitsgruppe beitreten (selbst wenn der beauftragende Bürger offline ist, falls sie die angezeigten Voraussetzungen erfüllen) und mit der Bearbeitung von Aufgaben beginnen.

Die Bezahlung kann in verschieden Formen erfolgen:
- [Currency], wird abhängig von der geleisteten Arbeit verteilt, entweder direkt oder nach Abschluss.
- [Reputation], wird vom Ersteller der Arbeitsgruppe an den Arbeiter gegeben (bezogen auf das ggf. eingestellte Tageslimit).
- Wissen einer bestimmten Spezialität (der selbe Effekt vom Lesen einer Fähigkeitsschriftrolle). Um diese Bezahlung zu wählen, muss der Ersteller das Fähigkeitsbuch der Spezialität besitzen oder in einem Arbeitsauftrag der Arbeitsgruppe erstellt werden.
- Gewähren eines [Title], welcher neue Privilegien für den Eigentumsnutzung oder anderer Fähigkeiten.

Die Wirtschaft von Eco fokussiert sich nicht nur auf den Handel von Waren, sondern auch den Austausch von Arbeit. Arbeitsgruppen machen es einfach verschiedene Arten von Arbeit an die gesamte Bevölkerung auszulagern.  
137;Arbeitsgruppen sind gemeinsame Vereinbarungen einer Reihe von Spielern zur Erfüllung einer bestimmten Aufgabe, wobei die Vergütung auf verschiedene Weise verteilt wird.
138;Das lebendige Biom der Welt, das Ressourcen bereitstellt, die der Mensch zum Überleben nutzen muss.
139;
Die enorme Vielfalt und die Reichhaltigkeit des Lebens auf unserem Planeten lassen sich grob in Bereiche einteilen, die Biome genannt werden. Biome in Eco sind Regionen der Welt, die bestimmte Niederschläge und Temperaturen haben. Aufgrund dieser simulierten physikalischen Unterschiede sind verschiedene Arten von Mikroorganismen, Pflanzen, Pilzen und Tieren in der Lage, in verschiedenen Biomen zu überleben und zu blühen. Jedes Biom in Eco bietet eine einzigartige Reihe von Ressourcen an, die der Spieler entdecken und abbauen kann, um seine Gesellschaft aufzubauen und zu versorgen. Die Lebensgemeinschaften innerhalb jedem Biom haben voneinander abhängige Beziehungen, die in der Regel an den Lebensraum, die Ernährung und den Boden gebunden sind, die wiederum durch das Klima und die vorhandenen Bodenressourcen entstehen. 
  
Biome sind Ökosysteme innerhalb des globalen Ökosystems, und innerhalb den Biomen gibt es manchmal weitere Unterteilungen oder Subbiome, wie z. B. die Hochwüste, Hochgrasprärie, Gletschereis in der Tundra oder Meeresküsten. Biome und Subbiome sind zusammenhängende Einheiten, von denen viele Einschränkungen haben, welche Biome sich neben oder innerhalb von ihnen befinden können. Im Laufe der Zeit, wenn sich die Bedingungen durch den Einfluss von den Spielern ändern, haben Biome das Potenzial, radikal umgestaltet zu werden. 

Der Klimawandel kann die Grenzen von Biomen verschieben und Gemeinschaften verdrängen. Einige Arten werden überleben und sich anpassen, aber andere werden nicht so widerstandsfähig sein. Direkte Bodenverschiebungen und andere Lebensraumzerstörungen durch Aktivitäten wie Bau, Landwirtschaft, Bergbau und Holzeinschlag werden sich ebenfalls in unterschiedlichem Maße auf Arten innerhalb von Biomen auswirken. Pflanzen- oder Tierarten bevorzugen möglicherweise nicht nur bestimmte Biome, sondern auch bestimmte Teile von diesen Subbiomen, was eine größere Auswirkung bedeutet, wenn diese stark lokalisierten Bereiche verändert oder zerstört werden. Resistente und anpassungsfähige Arten werden in der Lage sein, über Biomgrenzen hinweg zu gedeihen, wenn diese verändert werden, aber dieselben Arten können zu einer Bedrohung für empfindlichere Pflanzen oder Tiere in den neuen Biomen werden, in die sie eingeführt werden. 
140;Biome in Eco:
