141;Ozean : Die Teile des Ozeans auf den Kontinentalsockeln, die reich an Leben sind.
Tiefsee : Die tiefsten Teile des Ozeans, die die größten Meeresarten und wandernden Fischpopulationen tragen.
Kalte Küste : Strände und flache Gewässer in kälteren Klimazonen.
Warme Küste : Strände und flache Gewässer in wärmeren Klimazonen.
Feuchtgebiete : Ein einzigartiges Biom, das durch eine Sättigung des Bodens mit Süß- oder Brackwasser gekennzeichnet ist.
Grasland : Ein Biom, in dem es genug Wasser gibt, um Gräser, aber nicht viele Bäume zu tragen.
Wüste : Das trockenste Biom, und in Eco derzeit auch das heißeste.
Kalter Wald : Ein Biom, das feucht genug ist, um dichte Baumbestände zu tragen, und kalt genug, dass Nadelbäume dominieren.
Warmer Wald : Ein Biom, das feucht genug ist, um dichte Baumbestände zu tragen, und warm genug, dass Laubbäume dominieren.
Regenwald : Ein feuchtes und warmes Biom, das einen Wald mit reichlich Pflanzen- und Tierleben trägt.
Taiga : Ein kaltes und eher trockenes Biom, das einen spärlichen Wald aus Nadelbäumen trägt.
Tundra : Ein sehr kaltes Biom, das keine Bäume trägt, aber eine einzigartige Pflanzen- und Tiergemeinschaft trägt.
Eis : Die kältesten Gebiete des Landes, die von Gletschereis bedeckt sind. 

Es gibt derzeit auch einige Subbiome in Eco:

Hochwüste : Ein geologisch angehobener Teil der Wüste mit kältetoleranteren Arten, die sich an den durch Erosion entstandenen steilen Klippen wohlfühlen.
Kalte Steppe : Ein etwas kälteres Grasland, das oft durch noch weniger Bäume und größere Freiflächen gekennzeichnet ist.  
142;Das lebende System von Pflanzen und Tieren, das den Menschen die Grundlage bietet, zu überleben.
143;Diagramme
144;
Jede Welt in Eco speichert jede Aktion im Spiel und überwacht den Fortschritt von jedem Aspekt der Simulation. Die Daten werden in ein paar Hauptkategorien gespeichert, insbesondere das Ökosystem und die Wirtschaft. Wenn Spieler Aktionen durchführen oder sich das Ökosystem verändert, wird dies in Diagrammen dargestellt, die für die Bürger sichtbar sind.

Diese Diagramme sind am nützlichsten, um die Zustände verschiedener Messwerte zu vergleichen und sie im Laufe der Zeit zu betrachten. Als solche sind sie besonders nützlich, um die Ergebnisse von Gesetzen und Vorschriften im Nachhinein zu bestimmen, indem man untersucht, wie sich die Dinge verändert haben, nachdem sie eingeführt wurden. Sie sind auch nützlich, um zukünftige Effekte zu erschließen, die Geschwindigkeit vorherzusagen, mit der sich Dinge verändern (z.B. Bevölkerungsrückgang als Folge von Abholzung) und Änderungen vorzunehmen, bevor sie eintreten. Das Lesen, Verfassen und Verstehen von Diagrammen ist ein sehr mächtiges Mittel für die Regierung, und den Bürgern werden Mittel gegeben, um Diagramme zu erstellen, die Argumente unterstützen oder widerlegen, und sie ihren Mitbürgern direkt bei Diskussionen für bürgerliche Aktionen zu präsentieren.

145;Heatmaps
146;
Eco-Welten sind vielfältige Orte mit vielen verschiedenen Biomen und Orten menschlicher Entwicklung und Umweltauswirkungen. Um zu sehen, wie sich verschiedene Teile der Welt unterscheiden, stehen Heatmaps für alle verschiedenen Welteffekte im Spiel zur Verfügung. Werte wie Bürgeraktivität, Bevölkerungsrate, Verschmutzungsrate, Temperatur, Feuchtigkeit und Dutzende mehr können mit Heatmaps angezeigt werden, wobei Änderungen im Laufe der Zeit aufgezeichnet werden, die wiedergegeben und für wissenschaftliche Argumentationen verwendet werden können.

Spieler können diese auf zwei Arten anzeigen: über die Minikarte im Spiel, die auch farbiges Gelände im Spiel anzeigen kann. Zweitens können sie im Webbrowser angezeigt werden, wo ihre Fähigkeit zur Wiedergabe von Daten verschiedener Zeitpunkte genutzt wird. Alle 10 Minuten wird eine Momentaufnahme jeder Heatmap in den Serverdaten gespeichert (konfigurierbar), und die Bürger können sich in Zeitrafferansichten ansehen, wie sich die Heatmaps im Laufe der Zeit ändern. Dies ist wichtig, um die Auswirkungen an bestimmten Standorten zu messen und die besten Wege für den Bau von Infrastrukturen und neuen Siedlungen zu ermitteln.

147;Mini-Map
148;Die Minikarte ist ein leistungsstarkes Mittel im Spiel, das vielen Zwecken dient: Navigation, Planung, Datenanzeige, Ortung von Objekten und vielem mehr. Sie kann aktiviert werden, um die verschiedenen Weltebenen des Spiels (Heatmaps) anzuzeigen und Regionen mit hoher/niedriger Bevölkerung, Umweltverschmutzung, Bürgeraktivität usw. mithilfe eines Farbverlaufs hervorzuheben.  Weltmarkierungen können manuell oder global für alle Bürger hinzugefügt werden, um auf bestimmte Punkte zu verweisen und die Koordination menschlicher Aktivitäten zu unterstützen. Diese Markierungen werden auch verwendet, um die Bürger automatisch zu dynamischer Arbeit zu leiten und festzulegen, wo Straßen gebaut werden sollen in einem Vertrag, wo Waren für den Transport geliefert werden sollen usw.

Derzeit arbeiten wir daran, im Spiel die Bezeichnung von Grundstücken und Bezirken hinzuzufügen sowie bestimmte Landflächen für Arbeitsgruppen und Verträge festzulegen, damit beispielsweise die Bürger im Spiel die Bereiche hervorheben können, in denen sie andere einstellen möchten, um ein Feld zu pflügen oder eine Straße zu bauen usw. Dies wird die Möglichkeiten für den Arbeitsmarkt erheblich öffnen und es den Bürgern ermöglichen, auf einfachere Weise viel spezifischer zu sein, wenn sie festlegen, wo sie arbeiten möchten.
149;Das lebende System von Pflanzen und Tieren, das den Menschen die Grundlage bietet, zu überleben.
150;Der wahre Sinn des Lebens besteht darin, Bäume zu pflanzen, unter deren Schatten du nicht erwartest zu sitzen.\n– Nelson Henderson
151;

Das Ökosystem ist ein Selbstzweck in Eco, und sein kontinuierliches Gedeihen ist neben dem wirtschaftlichen Fortschritt das primäre Ziel des Spiels. Das heißt, das Ökosystem beginnt vollständig, und die Spieler müssen seine Ressourcen nutzen, ohne es aus dem Gleichgewicht zu bringen, was die Zerstörung der Menschheit bedeuten würde.

Das Ökosystem in Eco läuft in einer durchgehenden Simulation, die so lange aktiv ist, wie der Server läuft, unabhängig davon, ob Spieler im Spiel sind oder nicht. Jede simulierte Pflanze und Tier wächst, konsumiert Nahrungsquellen und vermehrt sich. Es ist die einzige Materialquelle, aus der die Spieler ihre Gesellschaft aufbauen müssen, und der Prozess der Gewinnung dieser Materialien wird starke Auswirkungen auf sie haben. Das Abholzen eines Waldes kann den Lebensraum einer Kreatur zerstören und sie zum Aussterben bringen. Abfälle von dem Bergbau kann nahegelegene Flüsse und Seen verschmutzen und Farmen vergiften, die darauf angewiesen sind. Die Handlungen der Spieler in Eco wirken sich auf ihre Umgebung aus, und die Spieler müssen die Auswirkungen verstehen, die sie haben, um zu überleben und den Meteor aufzuhalten. Das Ökosystem in einem unberührten Zustand zu belassen ist keine Option; der Meteor sorgt dafür, dass auch diese Wahl zur Zerstörung des Ökosystems führen wird. Um es zu retten, müssen die Bürger davon nehmen und eine Gesellschaft aufbauen, die die Macht hat, den Meteor zu stoppen, und gleichzeitig die Zurückhaltung hat, das Ökosystem dabei nicht zu zerstören.

152;Spielablauf
153;Das Ökosystem ist das grundlegende System, das die Bürger verstehen und mit dem sie sich auseinandersetzen müssen. Vom Anbau großer [Farms|Farming] und [Mines|Mining] bis hin zum Verständnis der Auswirkungen der [Pollution] durch Studien - die Auswirkung der Bürger auf das Ökosystem wird über Erfolg oder Misserfolg von Spielerentscheidungen entscheiden. Zu verstehen wie es mit Hilfe von [Data] im Spiel funktioniert, wird zu einer wichtigen Voraussetzung für das Überleben. Anders als die [Economy|Economy Overview] und die [Government|Government Overview], ist das Ökosystem kein Konstrukt der Bürger; sein Verhalten ist absolut, und nichts daran, wie es funktioniert, kann per Ermächtigung geändert werden, wie es die Wirtschaft kann. In diesem Sinne ist es ein Realitätscheck: der Ort, an dem die widersprüchlichen Vorurteile und Glauben der Bürger zusammenstoßen und die wahren Konsequenzen offenbaren.
154;Zwischen Wirtschaft und Regierung
155;Wenn die Bürger die Gesellschaft voranbringen, müssen sie sich vor der „Tragik der Allmende“ hüten. Wenn einer Bevölkerung ungehinderter Zugang zu einer gemeinsamen Ressource gewährt wird, führt dies häufig zu deren Zerstörung. Um dies zu verhindern, müssen sich die Bürger organisieren und Regeln für das Gemeinwohl durch [Laws] und andere staatsbürgerliche Vorschriften festlegen, die den Einzelnen einschränken, der Gruppe jedoch das Überleben ermöglichen. Dieser Konflikt, des Individuums gegen die Gruppe, bildet das Herzstück der Herausforderung, eine Zivilisation aufzubauen.
  
156;Das lebende System von Pflanzen und Tieren, das den Menschen die Grundlage bietet, zu überleben.
157;
Die Landwirtschaft bietet eine Möglichkeit, Pflanzenarten zu nutzen die für den Menschen am nützlichsten sind und eine globale Nahrungsmittelversorgung zu schaffen. Die Landwirtschaft kann sich auch auf Pflanzen konzentrieren, die für andere industrielle Zwecke nützlich sind, wie Biokraftstoff für eine potenziell erneuerbare Energiequelle.

Die Landwirte müssen auf die Ressourcen und die Gesundheit ihres Bodens achten, um Erschöpfung und Verschmutzung zu vermeiden. Düngemittel wie [CompostFertilizerItem] und Methoden zur Überwachung der Bodenressourcen wie der [SoilSamplerItem] werden wichtige Mittel sein, um das Ackerland fruchtbar zu halten. Verschiedene Fahrzeuge, Lagertechnologien und stärkere Handwerkzeuge werden es den Spielern ermöglichen, ihre landwirtschaftlichen Vorgänge auszubauen, während der Bedarf an Nahrungsmitteln und Kraftstoff in ihrer Gesellschaft steigt.

Die Landwirtschaft ist eine große Tätigkeit in Eco, die wir im Laufe der Entwicklung verbessern und erweitern wollen. Der Ausgleich und die Lagerung werden ein zentraler Bestandteil der Verbesserungen in der Landwirtschaft sein, da wir sicherstellen wollen, dass die Gesellschaften in Eco eine angemessene Nachfrage von den Farmern zu erzeugen, um das technologische Wachstum voranzutreiben, und dass die Lagerobjekte und Mechaniken existieren, um diese Nachfrage zu unterstützen. Die Landwirtschaft selbst hat viele mögliche Verbesserungen und Erweiterungen, darunter die Entwicklung und Modifizierung von Saatgut und Organismen, um fruchtbarer oder resistent gegen Schadstoffe oder andere Umweltfaktoren zu sein.
  
158;Erde
159;
Der Boden von Eco enthält Nährstoffe, die Pflanzen wachsen und gedeihen lassen: Zu viel oder zu wenig eines bestimmten Typs kann den Ertrag und die Wachstumsgeschwindigkeit sowohl natürlich vorkommender als auch gezüchteter Pflanzen verändern. Wenn Pflanzen wachsen, nehmen sie Nährstoffe aus dem Boden und geben sie zurück, wenn sie sterben, wodurch die Welt in einen natürlichen Gleichgewichtszustand versetzt wird. Die Spieler beeinflussen diese Veränderungen, indem sie die Pflanzen aus der Umwelt entfernen, sie ernten, abholzen, abbauen oder verschmutzen, was langsam Nährstoffe aus dem Boden entfernt. Spieler können Nährstoffe wieder einführen oder die vorhandenen Verhältnisse ändern, indem sie Düngemittel auf ihrem Land verwenden.

Wenn wir die Abhängigkeit der Tiere von den Pflanzenschichten erhöhen, können diese Teile der Ökosysteme den Boden weiter beeinflussen, da Arten, die Pflanzen konsumieren, auch Nährstoffe aus dem Boden entfernen können. Eine weitere Ergänzung, die in Betracht gezogen werden kann, ist die Existenz von Mutterboden in Eco: Derzeit ist er rein kosmetisch und an das Biom des Gebiets gebunden. In jedem Biom ist der Mutterboden jedoch eine einzigartige und wertvolle Ressource im Vergleich zu dem dichten Ton und Erde darunter.

160;Das lebende System von Pflanzen und Tieren, das den Menschen die Grundlage bietet, zu überleben.
161;
Der Boden unter dir beherbergt eine Vielzahl von Ressourcen wie Gesteinen Metalle und andere Mineralvorkommen. Verschiedene Gesteinsarten beherbergen verschiedene Arten von Mineralvorkommen oder eignen sich dazu, andere Ressourcen wie Erdöl zu fangen. Aufgrund der immensen Komplexität der Erdressourcen in der Realität und der Notwendigkeit in Eco, den Spielern zunächst ein vorhersehbares Gleichgewicht der Rohstoffe zur Verfügung zu stellen, werden Gesteine und ihre Ablagerungen auf der Grundlage von Biomen erzeugt. Jedes Biom verfügt über eine Reihe von zugehörigen Gesteinen und Ablagerungen, die sich schichtweise unter ihm ausbreiten.

162;Bergbau von Hand
163;
Um Erz abzubauen, musst du es zuerst lokalisieren. Erze in Eco sind jeweils in bestimmten Wirtsgesteinen beheimatet. Daher ist es ein guter Anfang, zu lernen, welche Gesteine die gewünschte Erzart haben, um dann in der Nähe von Gesteinen dieser Art zu graben. Verwende eine [WoodenShovelItem] oder besser, um Erde von der Oberfläche zu entfernen oder von der Seite in einen Hügel zu graben. Sobald du auf Stein getroffen bist, durch den du graben möchtest, muss du eine Spitzhacke wie die [StonePickaxeItem] verwenden, um ihn zu brechen. Wenn du Steine mit der Spitzhacke brichst, brichst du manchmal ein größeres Stück Stein ab, das erneut gehackt werden muss, um in Stücke zu zerbrechen, die klein genug sind, um aufgenommen zu werden. Es ist eine gute Idee, Steine beim Brechen aufzunehmen und an anderer Stelle zur späteren Verwendung zu stapeln, vorzugsweise in einem [StockpileItem] oder Fahrzeug, mit dem du dein Erz transportierst, wie einem [WoodCartItem].

164;Mineralienverarbeitung
165;
Sobald du eine große Menge Metallerz gesammelt hast, musst du das Erz verarbeiten, bevor du Metallprodukte damit herstellen kannst. Dies ist ein schmutziger und teurer Prozess, und die Optimierung des Prozesses und der daraus resultierenden Nebenprodukte ist ein ständiger Prozess. Die drei Hauptschritte der Mineralaufbereitung sind:

Zerkleinerung: Zerkleinerung bedeutet, das Gestein in kleinere Partikel zu zerkleinern, die weiterverarbeitet werden können. Zerkleinertes Gestein der Art, in der sich das Erz befindet, ist das Hauptnebenprodukt dieses Prozesses.
Konzentration: Die Konzentration ist ein Weg, um die gewünschten Metalle in einem Erzgestein vom Abfallgestein zu trennen. Dieser Prozess ist niemals perfekt und führt unweigerlich zu einer großen Menge Gesteinsabfälle, die noch Spuren von freigesetzten Metallen enthalten. Dieses Abfallgestein mit Spuren von Schwermetallen ist als [TailingsItem] bekannt. [CopperOreItem] und [GoldOreItem] erfordern chemisches Auslaufen und Nassverarbeitung, um sich von ihren Wirtsgesteinen zu trennen und somit während des Konzentrationsprozesses verschmutzteres und flüchtigeres [WetTailingsItem] zu erzeugen.  
Schmelzen: Sobald du wertvolles Erzkonzentrat hast, kannst du es endlich in Metallprodukten wie [IronBarItem] bei einem [BloomeryItem] oder mithilfe einer fortschrittlicheren Schmelztechnologie schmelzen. 

166;Das lebende System von Pflanzen und Tieren, das den Menschen die Grundlage bietet, zu überleben.
167;
Bei der Verbrennung von Brennstoffen zum Kochen oder zur Stromerzeugung, beim Schmelzen von Metallen, bei der Verarbeitung von Abwässern und bei zahllosen anderen notwendigen industriellen Aktivitäten ist ein häufiges Nebenprodukt die Verschmutzung. Verschmutzung ist jede Substanz, die als Schadstoff oder Gift wirken kann, wenn sie in die Umwelt zurückgeführt wird. In Eco gibt es viele Quellen und verschiedene Arten der Verschmutzung, von denen einige stärker sind als andere. Schwermetalle können den Boden verseuchen und die verfügbaren Nährstoffe sowie die Gesundheit der darauf und darin lebenden Pflanzen und Tiere beeinträchtigen. Wasser kann Schadstoffe schnell verbreiten und das Ausmaß ihrer Auswirkungen erhöhen. Luftverschmutzung kann unsichtbar oder offensichtlich aus einem Ofen oder einem Kraftwerk strömen, die zu Treibhausgasen beiträgt und die Luftqualität beeinträchtigen, sowie als saurer Regen auf den Boden zurückfallen. 

Um das Überleben der Ökosysteme zu sichern und Ressourcen wie Boden und Wasser zu erhalten, müssen die Spieler die Quellen der Verschmutzung, die ihre Zivilisation verursacht, regeln und eindämmen. In einigen Fällen werden Verschüttungen oder tödliche Konzentrationen unvermeidlich sein, und dann kann die Sanierung und Lagerung die einzige Option sein, um das Land wieder in einen unversehrten Zustand zu versetzen. 

168;Bodenverschmutzung
169;
Einmal in den Boden und den Grundwasserspiegel freigesetzt, sind Bodenverschmutzungen nicht leicht zu stoppen oder zu entfernen. Verschiedene Materialien in Eco sind Quellen der Bodenverschmutzung, insbesondere Bergbaurückstände und Müll aus Herstellungs- und anderen Spieleraktivitäten. Die Verschmutzung breitet sich als Gradient aus, dessen Konzentration mit der Zeit zunimmt, wenn die Schadstoffquelle erhalten bleibt oder zunimmt. Wenn die Schadstoffquelle nicht mehr mit dem Boden in Berührung kommt, verteilt sich die Bodenverschmutzung und verschwindet mit der Zeit.

170;Luftverschmutzung
171;
Viele Spieleraktivitäten können schädliche Emissionen verursachen, die, wenn sie in die Atmosphäre freigesetzt werden, als Luftverschmutzung wirken. Das Herstellen an Objekten mit CO2-Ausstoß oder das Betreiben von Generatoren mit diesen trägt zur lokalen und globalen Verschmutzung bei. Über lange Zeiträume hinweg trägt der globale CO2-Gehalt zu einem globalen Erwärmungseffekt bei, der sich wiederum auf den Meeresspiegel auswirkt. Es gibt natürliche Senken und Einlässe für einige Schadstoffe wie CO2 wie Wälder.

Die Konzentrationen der Luftverschmutzung fallen als saurer Regen auf den Boden zurück, den wir anhand der Luftverschmutzung und der lokalen Niederschlagsmengen simulieren. 

172;Wasserverschmutzung
173;
Wasser ist ein Medium, durch das sich die Verschmutzung schneller und weiter ausbreitet, stromabwärts rauscht und sich in Seen oder Ozeanen ausbreitet. Die Verschmutzung des Wassers kommt in der Regel von nahegelegenen Bodenverschmutzungsquellen, kann aber in Gebieten mit viel Luftverschmutzung auch über den Mechanismus des sauren Regens ins Wasser gelangen. 

Die Beseitigung der Quelle ist derzeit der einzige Weg, um die Wasserverschmutzung zu stoppen, aber Reinigungs- und Sanierungsstrategien sind Funktionen, die wir für die Zukunft in Betracht ziehen.

174;Eindämmung
175;
In vielen Fällen gibt es keine perfekte Lösung für den Umgang mit umweltschädlichen Materialien. Es muss Platz für die Lagerung verschiedener Schadstoffe geschaffen werden, und Schadstoffe müssen so gelagert werden, dass sie nicht in die Umgebung gelangen können. Dies ist eine Herausforderung, die für das Umweltmanagement der Industrie in Eco von entscheidender Bedeutung sein sollte. Gegenwärtig erfordern Rückstandmechaniken eine tiefe unterirdische Lagerung; dies wird mit der weiteren Entwicklung verbessert. 

Die Eindämmungsmaßnahmen sind die Spitze der Funktionen, die wir im Zusammenhang mit der Schadstoffgruppe von Funktionen in Eco verbessern möchten. Die Spieler sollten Eindämmungen verwenden, um mit den enormen Mengen an Rückständen und Müll umzugehen, die ihre Gesellschaften produzieren.

176;Das lebende System von Pflanzen und Tieren, das den Menschen die Grundlage bietet, zu überleben.
177;In Verfassungsartikeln wird festgelegt, wie die Dinge in der Regierung geschehen: wer kann Gesetze verabschieden, Steuern festlegen, Regeln ändern usw. Sie kann auch bestimmte Maßnahmen als Wahl-bedürftig definieren, indem sie einen [Election Process|Election Processes] dazu festlegen.  

Verfassungsartikel können an zwei Stellen hinzugefügt werden. An einem [CapitolItem] kannst du bis zu drei hinzufügen, und auf [AmendmentsItem] kannst du weitere 10 pro Element hinzufügen.

Die Festlegung der Regierungsregeln ist sehr wichtig, um eine stabile, Gesellschaftsunterstützende Struktur zu gewährleisten. Regierungen können mit Gesetzen viel Macht über die Welt erhalten, und es besteht die Gefahr, dass diese Macht missbraucht wird. Durch Gewaltenteilung können die Bürger eine Regierung entwerfen, die eine Reihe von Veränderungen durchlaufen kann, einschließlich Veränderungen in der Führung, und dabei die Macht behält, positive Veränderungen in der Welt zu bewirken.

178;Eine Reihe von Regeln darüber, wie die Regierung arbeitet.
179;Eine Verfassung ist ein Gründungsdokument, das definiert, wie eine Gesellschaft regiert wird. Vor jedem anderen Regierungsobjekt muss eine Verfassung geschaffen werden. Sie werden in einem [Capitol|CapitolItem] erstellt.
 
Regierungen Stürzen
Sobald ein Kapitol platziert ist, kann eine Verfassung ratifiziert werden, indem du es öffnest und auf Ratifizieren klickst. Solange es keine anderen Verfassungen gibt, wird die Regierung sofort geschaffen.
 
Wenn bereits eine Verfassung aktiv ist, kann eine neue Verfassung nur dann an ihre Stelle treten, wenn der Wohnwert ihres Raumes die bestehende Verfassung in Abhängigkeit von den Servereinstellungen erheblich übersteigt. 
 
Hinweis: Ein bevorstehendes Update von Eco ermöglicht mehrere gleichzeitige Regierungen.
180;Das Gründungsdokument für eine Regierung.
181;
  Bevölkerungsgruppen sind Klassen von Bürgern, die in der Regierung erstellt wurden. Diese können dann überall dort verwendet werden, wo du einen Bürger angeben kannst (Berechtigungen, Gesetze usw.).

Zum Beispiel könnten Bürger eine Bevölkerungsgruppe „Holzfäller“ definieren, die nur Spieler mit einer Holzbearbeitungsstufe von 3 oder mehr enthält. Dann könnte ein Gesetz geschaffen werden, das es Holzfällern nur erlaubt, alte Bäume zu fällen.

Bevölkerungsgruppen werden in einem [Census Bureau|CensusBureauItem] definiert.

Bevölkerungsgruppen können auch Löhne festgelegt werden. Die Löhne werden regelmäßig gezahlt, solange ein Bürger in der Bevölkerungsgruppe ist.

182;Definiert eine Gruppe von Bürgern, die bestimmten Kriterien entsprechen.
183;Distrikte werden von Spielern an einem [ZoningOfficeItem] erstellt und können als gesetzlich festgelegte Bereiche verwendet werden.

Ein Distrikt ist ein ausgewählter, nicht zusammenhängender Landbereich, den die Spieler nach Belieben anpassen können. Distrikte sind in Distriktskarten enthalten, und es kann mehrere Distriktskarten auf der Welt geben. Innerhalb jeder Distriktskarte dürfen sich jedoch keine Distrikte überschneiden.

Distrikte können verwendet werden, um festzulegen, wo Aktionen gesetzlich zulässig sind. Es kann beispielsweise ein Gesetz erlassen werden, das das Fällen von Bäumen in einem Schutzgebiet im Distrikt verhindert.

184;Ein definierter Landabschnitt, auf den sich Gesetze und andere Systeme beziehen können.
185;Gewählte Titel sind Regierungsbeamte, denen Berechtigungen zur Verwaltung der Regierungspolitik zugewiesen werden können. Diese Titel können überall dort verwendet werden, wo man einen Bürger angeben kann (Berechtigungen, Gesetze usw.). 

Gewählte Titel werden bei einem [GovernmentOfficeItem] erstellt. Bei der Definition eines gewählten Titels können verschiedene Bedingungen festgelegt werden:

  - Ein [Election Process|Election Processes] mit Amtszeit für Titelträger
  - Die Anzahl der Bürger, die gleichzeitig den gewählten Titel besitzen können
  - Voraussetzungen, um nach der Wahl im Amt zu bleiben
  - Ein Nachfolger, der die Position übernimmt, wenn ein Titelträger aus dem Amt abberufen wird

Beim Erstellen eines ausgewählten Titels können die folgenden Berechtigungen zugewiesen werden:

  - Festlegen des Steuersatzes bei einer [TreasuryItem]
  - Zugang, um das Geld auf dem Bankkonto der Staatskasse auszugeben
  - Regierungsbankprivilegien zur Einrichtung von Regierungsbankkonten, die von persönlichen Vermögensberechnungen ausgenommen sind
  - Die Möglichkeit, eine globale Kartenmarkierung zu setzen, um die Bürger auf einen Punkt von Interesse zu informieren

Gewählte Titel können Löhne zugewiesen werden, die regelmäßig an die Bürger gezahlt werden, die den Titel besitzen.
  
186;Gewählte Titel sind Regierungsbeamte, denen Berechtigungen zur Verwaltung der Regierungspolitik zugewiesen werden können.
187;Bürger können an einem [BoardOfElectionsItem] neue Arten von Wahlen definieren, und jeder dort erstellte Wahlprozess kann für verschiedene Änderungen an Regierung und Führung verwendet werden.

[Civic Articles] können auf Wahlprozesse verweisen, um Maßnahmen zu bezeichnen, die eine Wahl erfordern. [Elected Titles], die in einem [GovernmentOfficeItem] erstellt werden, müssen einen Wahlprozess angeben, durch den neue Mitglieder gewählt werden.

Jeder Wahlprozess kann einen anderen Satz von Wählern, Vetos, Zeitpunkten, Prozentsätzen, die zum Gewinnen benötigt werden, usw. definieren. Durch die Verwendung verschiedener Wahltypen können die Bürger ihre Regierung so gestalten, dass sie unterschiedliche Machtbefugnisse hat. Zum Beispiel können sie einen mächtigen Titel definieren, der von der Bevölkerung gewählt werden muss, aber auch von ihr abgewählt werden kann.  

188;Definiert, wie eine Wahl stattfindet.
189;Wahlen können zwei Arten haben:
  
    - Wahlen von Beamten. Dies sind Wahlen von [Elected Titles], die einem Bürger bestimmte Befugnisse verleihen.
    - Volksabstimmung. Eine Ja/Nein-Abstimmung, die bestimmt, ob eine bestimmte bürgerliche Aktion durchgeführt werden soll.

Wahlen werden an einer [BallotBoxItem] gestartet, an der die Bürger eine Reihe von Bürgeraktionen durchführen können. Je nachdem, welche [Civic Articles] verfügbar sind, können diese Maßnahmen eine Wahl erfordern oder nicht. Wenn sie eine benötigen, hat der Bürger die Möglichkeit, sofort eine zu starten.

