  - [CookingSkill] ist die zweite Stufe im Beruf des Kochs, der einen [CastIronStoveItem] verwendet, um hochwertigere Mahlzeiten herzustellen.
  - [BakingSkill] ist eine Alternative zum Kochen, bei der [FlourItem] zur Herstellung von Backwaren verwendet wird.
  - [AdvancedCookingSkill] ist ein hochstufiger Kochberuf, der die höchste Stufe von Speisen herstellt.
  - [AdvancedBakingSkill] ist eine Alternative zum Fortgeschrittenen Kochen, die [YeastItem] verwendet, um hochwertige Backwaren mit [LeavenedDoughItem] herzustellen.  
244;Köche kochen qualitativ hochwertige Speisen, mit denen die Bürger schneller Erfahrungen sammeln können.
245;Ingenieure nutzen die von anderen Berufen geschaffenen Materialien, um den technologischen Fortschritt voranzutreiben. Die Fahrzeuge, die sie produzieren, verbessern die Kapazität für den Handel und die Geschwindigkeit, mit der die Bürger arbeiten, erheblich. Die von ihnen hergestellten Handwerkstische werden von verschiedenen Berufen verwendet, um hochwertige Waren herzustellen. Ingenieur zu sein erfordert eine häufige Interaktion mit anderen Berufen, da Ingenieure nicht in der Lage sind, die für das Handwerk erforderlichen primären Beiträge zu produzieren.
  
- Mit [BasicEngineeringSkill] können Bürger Straßen und Karren herstellen, um den Transport zu erleichtern. Darüber hinaus erstellt der Grundmaschinenbau die Handwerkstische, die für die Verarbeitung und das Schmelzen von Erz erforderlich sind.
- Mit [MechanicsSkill] können Bürger frühe motorisierte Fahrzeuge wie ein [SteamTruckItem] erstellen. Die Mechanik ist die erste elektrische Energiequelle, die den technologischen Fortschritt ermöglicht.
- Mit [IndustrySkill] können Bürger fortschrittliche Fahrzeuge wie ein [ExcavatorItem] erstellen, mit dem große Mengen natürlicher Ressourcen schnell gesammelt werden können.
- Mit [OilDrillingSkill] können Bürger ein [PumpJackItem] verwenden, um [PetroleumItem] für Kraftstoff und eine Vielzahl von Industrieprojekten zu sammeln.
- [ElectronicsSkill] ist eine luxuriöse Spezialisierung für Ingenieure, die teure Zutaten verwendet, um die fortschrittlichsten Materialien herzustellen, die für moderne Herstellungsprojekte benötigt werden. Neben der Bereitstellung von Ökostrom wird mithilfe der Elektronik das [LaserItem] hergestellt, das zur Rettung der Welt vor dem Meteor benötigt wird.
  
246;Ingenieure sind meisterhafte Erfinder, die Fahrzeuge und andere fortschrittliche Produkte für andere Bürger herstellen.
247;
Landwirte sind Spezialisten in der Landwirtschaft. Die von ihnen produzierten Feldfrüchte sind eine Hauptquelle für die Kalorien, die die Bürger für ihre Arbeit benötigen.
  - [GatheringSkill] erlaubt es Bürgern, Saatgut aus Produkten zu erzeugen, um große Farmen zu schaffen.
  - [FarmingSkill] erlaubt es den Bürgern, dem Boden Nährstoffe hinzuzufügen und die Bodenbedingungen mit einem [SoilSamplerItem] zu testen.
  - [FertilizersSkill] erlaubt es Bürgern, mehr Produkte sowohl von wilden Pflanzen als auch von Menschen angelegten Farmen zu ernten.
  - [MillingSkill] erlaubt es Bürgern, Produkte in einem [MillItem] zu verarbeiten, damit sie von Köchen in fortgeschritteneren Rezepten verwendet werden können.
  
248;Landwirte sind Spezialisten in der Landwirtschaft.
249;
    Jäger sind Spezialisten für die effiziente Jagd auf Tiere und die Zubereitung von Fleisch für die Verwendung durch Köche. Die beiden Jägerspezialitäten sind eng miteinander verbunden, da die gejagten Tiere verarbeitet werden müssen, bevor sie von einem Koch verwendet werden können. 
    
  - Der [ButcherySkill] ermöglicht es Bürgern, Tierkadaver zu zubereitetem Fleisch für Köche zu verarbeiten. Die dabei entstehenden Felle und Häute können für Kleidung und andere Herstellungsprojekte verwendet werden.
  - Der [HuntingSkill] gewährt Bürgern zusätzlichen Schaden bei der Jagd auf Tiere und ermöglicht es ihnen, sich Tieren auf eine geringere Distanz zu nähern, ohne dass diese weglaufen.
  
250;Jäger sind Spezialisten für die Jagd auf Tiere und die Zubereitung von Fleisch für Köche.
251;Steinmetze sind Spezialisten im Abbau und der Bearbeitung von Stein. Sie sind eine wertvolle Quelle für Baumaterial und Möbel für Häuser. Das Erz, das sie sammeln, wird von Schmieden zum Schmelzen von Metallbarren verwendet.
  
  -[MiningSkill] ermöglicht es Bürgern, beim Abbau von Stein und Erz weniger Kalorien zu verbrauchen. Bergarbeiter verarbeiten auch das gesammelte Erz und konzentrieren es, um es für die Verhüttung zu verwenden.
  -[MasonrySkill] erlaubt es Bürgern, [MortarItem] zu produzieren, eine Hauptzutat für die meisten Baumaterialien der Maurer. Das [MortaredStoneItem], das sie produzieren, ist eine großartige Quelle für frühes Baumaterial.
  -Der [PotterySkill] erlaubt es Bürgern, [BrickItem] Baumaterial und Möbel aus [ClayItem] herzustellen.
  -[GlassworkingSkill] erlaubt es den Bürgern, [GlassItem] und später [FramedGlassItem] herzustellen. Glas ist ein schönes ergänzendes Baumaterial und wird in einer Vielzahl von industriellen Projekten verwendet.
  -[AdvancedMasonrySkill] ist eine hochstufige Steinmetz-Fertigkeit, die feinstes Baumaterial und Möbel aus Quaderstein herstellt.
  
252;Maurer sind Spezialisten im Bergbau und in der Arbeit mit Stein.
253;Berufe sind Gruppen ähnlicher [Specialties], die neue Herstellungsrezepte freischalten und Fähigkeiten wie reduzierten Kalorienverbrauch beim Herstellen oder Verwenden eines Werkzeugs bieten. Innerhalb jedes Berufs gibt es eine Gruppe von ähnlichen Spezialisierungen.
  
Nachfolgend steht eine Liste aller Berufe und der entsprechenden Spezialisierungen. Die Bürger können sich auf einen Beruf konzentrieren oder Spezialitäten aus verschiedenen Berufen lernen.
  
254;Berufe verleihen den Bürgern besondere Fähigkeiten und die Fähigkeit, fortgeschrittene Gegenstände herzustellen.
255;Schmiede schmelzen konzentriertes Erz zu Metallbarren, die von einer Vielzahl von Berufen verwendet werden können. Darüber hinaus stellen die Schmiede bessere Werkzeuge her, die den Bürgern helfen, produktiver zu arbeiten.
  
- [SmeltingSkill] sind Spezialisten für die Herstellung von Metallbarren, die die Grundlage für den technologischen Fortschritt bilden. Die Eisenwerkzeuge, die sie herstellen, bieten erhebliche Vorteile gegenüber den frühen Steinwerkzeugen.
- [AdvancedSmeltingSkill] ermöglicht es den Bürgern, Eisenbarren weiter zu [Steel|SteelBarItem] zu veredeln, um sie in der Industrie und für hochwertige Baumaterialien zu verwenden. Bürger mit dieser Spezialität können den von ihnen hergestellten Stahl zu noch moderneren Werkzeugen verarbeiten als die durch einfaches Schmelzen hergestellten Eisenwerkzeuge.  
256;Schmiede schmelzen Erz zu Metallbarren und stellen fortschrittliche Werkzeuge her.
257;Alle Bürger sind Überlebenskünstler in der Welt von Eco. 
  
Erfahrung in [SelfImprovementSkill] wird immer dann gesammelt, wenn ein Bürger in einer anderen Spezialisierung aufsteigt. Selbstverbesserung hat zwei Hauptvorteile. Dadurch dass die Bürger fortschreiten, werden sie eine erhöhte Tragfähigkeit und eine größere Magenkapazität für zusätzliche Kalorien haben. Darüber hinaus werden bei Verwendung von Hämmern, Schaufeln und Bohrern weniger Kalorien verbraucht.
  
258;Überlebenskünstler verbrauchen weniger Kalorien, wenn sie grundlegende Werkzeuge verwenden, und haben ein höheres Traggewicht.
259;Schneider arbeiten mit Stoff, um Kleidung und hochwertige Möbel für andere Bürger herzustellen. Im Gegensatz zu anderen Berufen hat der Schneiderberuf nur eine Spezialität.

Mit [TailoringSkill] können Bürger [ClothItem] für Herrstellungsprojekte verschiedener Berufe erstellen. Die Kleider, die Schneider erstellen, bieten den Bürgern besondere Prämien. Beispielsweise hat ein [BigBackpackItem] eine höhere maximale Gewichtsgrenze als der Starter-[BasicBackpackItem].
	
260;Schneider arbeiten mit Stoff, um Kleidung und hochwertige Möbel für andere Bürger herzustellen.
261;Jedes Objekt, das eine Fahrzeug-Komponente enthält, kann auf verschiedene Weise gefahren und benutzt werden, was eine Reihe von Vorteilen bietet.
  
Viele Fahrzeuge benötigen [Power|Power Component] zum Betrieb und jedes hat seine eigene [Storage|Storage Component]. Durch den Aufbau einer Infrastruktur auf der ganzen Welt werden deine [Transport] -Fähigkeiten erheblich verbessert, da viele Fahrzeuge Straßen benötigen, um zu funktionieren.
262;  
- Transport: Fahrzeuge wie das [WoodCartItem] können Güter und Personen von Ort zu Ort transportieren. Mit fortschreitender Technologie werden fortschrittlichere Fahrzeuge mit höheren Bewegungsgeschwindigkeiten und höherer Tragfähigkeit auf Kosten der Entstehung von Umweltverschmutzung verfügbar

- Ausgrabung: Mit [ExcavatorItem] und [SkidSteerItem] können große Mengen von Erde und Gestein schnell bewegt werden. Dies erhöht die Geschwindigkeit von [Mining] erheblich und ermöglicht eine schnelle Rodung von Landflächen für neue Bauprojekte.

- Bau: Das [CraneItem] kann schnell große [Building] -Projekte fertigstellen. Der Kran hat eine viel größere Reichweite als ein Bürger, der mit einem Hammer baut und kann auf große Mengen an Lagerung zugreifen.

264;Fahrzeuge besitzen vielfältige Einsatzmöglichkeiten.
265;
In Eco ernten die Spieler zunächst Nahrung aus den wilden Biomen um sie herum. Pflanzen, die reif für die Möglichkeit sind, nachhaltig zu ernten, gibt es im Überfluss. Wilde Nahrungsquellen können als zusätzliche erneuerbare Ressource dienen, werden aber schnell versiegen, wenn sie ausgenutzt werden. Einige Pflanzen sind für mehr als nur Nahrung nützlich: sie können chemische Verbindungen liefern, die nirgendwo anders gefunden werden können, oder die Rohstoffe, die für Textilien und Kleidung benötigt werden.

Verschiedene Pflanzen erfordern unterschiedliche Werkzeuge zum Ernten, wie z. B. eine Schaufel oder eine Sense. Andere Arten können ohne Werkzeug von Hand gepflückt werden. Ebenso werden einige Pflanzen beim Ernten abgetötet, während bei anderen die gepflückten Früchte einfach wieder nachwachsen, wenn sie weiter wachsen und gesund sind. 


  
266;Das lebende System von Pflanzen und Tieren, das den Menschen die Grundlage bietet, zu überleben.
267;
Tierarten sind Bewohner der Welt in Eco, die sich hinsichtlich der möglichen Nutzung als Ressourcen stark unterscheiden. Einige Arten eignen sich hervorragend für Fleisch- und Nahrungsquellen wie Milch, während andere nützliche Nebenprodukte wie Wolle, Leder, Talg oder Knochenmehl liefern können. Tiere unterscheiden sich jedoch auch stark in Bezug auf ihre Widerstandsfähigkeit und Anpassungsfähigkeit an Auswirkungen auf ihre Populationen, ihren Lebensraum und ihre Nahrungsquellen. 

Durch die Jagd können Spieler verschiedene Fallen und Handwerkzeuge verwenden, um wilde Tiere direkt aus den Ökosystemen zu ernten, in denen sie leben. Die Jagd kann auch dazu dienen, übermäßige Tierpopulationen zu kontrollieren oder zu erlegen. Die Jagd wird eine wichtige, aber nicht unbedingt notwendige Aktivität für die Spieler sein, insbesondere am Anfang, um den Appetit einer großen Gesellschaft zu stillen. 

Die Jagd auf ein Tier ist nur der erste Schritt, um es optimal zu nutzen. Dank der Fortschritte in der Metzgerei können Spieler Tiere für eine Vielzahl von tierischen Produkten verarbeiten und verwenden. Die Zusammenarbeit mit anderen Berufen wie Köchen und Schneidern wird viele ernährungsphysiologische, industrielle und sogar kulturelle Verwendungszwecke für Tiere und ihre Produkte freisetzen, die nicht alle durch die Jagd erreicht werden müssen. Wenn jedoch ein bestimmtes tierisches Produkt in der Wirtschaft populär wird, muss darauf geachtet werden, dass kein zerstörerischer Druck auf eine Art ausgeübt wird. Die Jagd ist oft der letzte Schlag für eine gefährdete Art, deren Produkte mit zunehmender Seltenheit immer wertvoller werden.

Um mit der Jagd zu beginnen, musst du ein [WoodenBowItem] und einige [Arrows|Arrow Item] herstellen. Fortgeschrittenere Bögen erleichtern es, dein Ziel schnell zu treffen. Denke daran, dass Tiere mit einem gezielten Schuss schneller getötet werden können und dass es möglicherweise einfacher ist, einige Tiere je nach Tageszeit zu jagen. 
  
268;Das lebende System von Pflanzen und Tieren, das den Menschen die Grundlage bietet, zu überleben.
269;Ecopedia-Leitfaden für den Einstieg.
270;
    Sobald du deine Grundbedürfnisse gedeckt hast, ist es Zeit darüber nachzudenken, wie du zum Gemeinschaftsprojekt der Gesellschaft beitragen möchtest, und dein Beruf ist, wie du das tust.
  
271;

In jedem Beruf befindet sich eine Reihe von [Specialties], die besondere Fähigkeiten freischalten. Da die Bürger nur eine begrenzte Anzahl von Spezialisierungen haben können, ist es ein guter Ansatz, verschiedene Spezialisierungen zu nehmen und dann untereinander [Trade] zu treiben. Im Fähigkeitsfenster kannst du sehen, wie viele Bürger sich für einen Beruf entschieden haben, und nach den am meisten benötigten Fähigkeiten suchen, um diejenigen auszuwählen, auf die du dich konzentrieren möchtest.
  
272;
    Sehe dir die [Profession Overview] an, um einen Überblick über die verschiedenen Optionen zu erhalten.
  
273;(Beachte: Der Fertigkeiten-Dialog ist bis zum Ende des Tutorials ausgeblendet. Er kann durch Abschließen des Tutorials oder Überspringen sichtbar gemacht werden)
 
274;Eine Welt mit einer Reihe von Berufen kann zum gegenseitigen Nutzen handeln.
275;
    Die [Government|Government Overview] von Eco wird von einzelnen Bürgern betrieben, und die Qualität der Regierungsführung hängt vollständig davon ab, wie sich diese Bürger beteiligen.

     Es gibt eine Reihe von Möglichkeiten, sich an der Regierungsführung zu beteiligen, darunter:

     - Gründung der Regierung durch Erstellung eines [CapitolItem] und einer [Constitution].
     - Definieren von Bürgerrechten, einschließlich  [Districts], [Demographics], [Elected Titles], [Election Processes], und [Amendments|Constitution].
     - Bewerbung als Kandidat für einen [Elected Title|Elected Titles] mit besonderen Befugnissen, die ihm von der Verfassung zugewiesen wurden.
     - Erlass von [Laws] nach Erlangung des Privilegs dies zu tun (in der Verfassung definiert).
     - Erlass von [Executive Actions] mit Privilegien, die auch in der Verfassung festgelegt sind.
     - Abstimmung in [Elections] für [Elected Titles] und andere Bürgeraktionen.
     - Debattiere Gesetze unter Verwendung von [Data] und präsentiere deinen Mitbürgern Argumente, die für oder gegen eine Entscheidung argumentieren.
  
276;
    Jede dieser Optionen ist an einer Vielzahl von Orten verfügbar, die von Bürgern errichtet werden müssen. Die aktuelle Regierung kann durch Auswahl des Regierungssymbols in der Aktionsleiste angezeigt werden. Wenn du den Mauszeiger über jeden Abschnitt bewegst, wird angegeben, wo das Bürgerrecht definiert ist.
  
277;Deine bürgerlichen Pflichten sind die vielen verschiedenen Möglichkeiten, wie du mit der Regierung interagieren kannst.
278;Um eine Gesellschaft durch die Jahrhunderte auf den Höhepunkt der Technologie zu bringen, ist eine blühende [Economy|Economy Overview] erforderlich, und durch ihre Teilnahme können die Bürger sowohl zum Fortschritt der Gesellschaft beitragen als auch ihre eigenen Fähigkeiten und ihren Wohlstand fördern.
 
Die Teilnahme an der Wirtschaft erfolgt durch den [Trade] mit Waren und Dienstleistungen. Durch die Suche nach bestehenden Siedlungen mit [Stores|Store Component], [Contracts] und [Work Parties] können die Bürger die Waren und Arbeitskraft, auf die sie sich spezialisiert haben, gegen die Spezialisierungen anderer eintauschen und ihre individuellen Ziele schneller erreichen, als wenn sie jeweils alleine gearbeitet hätten.  
Wenn du neue Projekte übernimmst, für die Materialien oder Arbeitskraft erforderlich sind, die du selbst nicht herstellen oder ausführen kannst, kannst du stattdessen die Waren und Dienstleistungen verkaufen, die du auf dem Markt ausführen kannst, indem du Geschäfte erstellst und Preise in einer [Currency] deiner Wahl festlegst. Wenn du diese Währung verwendest, um Waren und Dienstleistungen anderer zu kaufen, kannst du diese Ziele erreichen, ohne alles selbst lernen zu müssen.

Wenn du deine Fähigkeiten ausbaust und mehr und mehr anderer Bürger benötigst, kannst du deine eigenen Geschäfte, Verträge und Arbeitsgruppen einrichten, um deren Hilfe zu suchen. Wenn du Wohlstand erwirbst, steigt deine Fähigkeit, Veränderungen (sowohl gute als auch schlechte) herbeizuführen. 
279;Der effizienteste Weg, um in Wissen und Technologie Fortschritte zu erzielen, ist der Handel in der Wirtschaft.
280;Während eine funktionierende Gesellschaft notwendig ist, um den Meteor aufzuhalten, muss jeder Einzelne seine eigenen Bedürfnisse befriedigen, angefangen bei Nahrung und Unterbringung.
 
281;Auswahl einer Siedlung
282;Wenn du dich für einen Standort entscheidest, an dem du dich niederlassen möchtest, solltest du die folgenden Faktoren berücksichtigen:
283;Nähe zu Ressourcen
Natürliche Nahrungsquellen und Baumaterialien in der Nähe werden die ersten Fortschritte erheblich beschleunigen.

Nähe zu Anderen
Die Einrichtung in der Nähe anderer Siedlungen bietet einen deutlichen Vorteil, da du dann mit anderen handeln kannst, um schneller Fortschritte zu erzielen. Ein überfülltes Gebiet kann jedoch auch begrenzte Möglichkeiten für Expansion und natürliche Nahrung in der Nähe haben. Du solltest ein Gleichgewicht finden, das auf deinen persönlichen Vorlieben basiert.
  
284;Dein Grundstück Beanspruchen
285; Sobald du einen Ort für den Bau deiner ersten Siedlung ausgewählt hast, möchtest du [Property] um ihn herum beanspruchen. Wenn du dein Startzelt aufstellst, geschieht dies automatisch, und weiterer Grund kann mit Landpapieren beansprucht werden. Von dir beanspruchter Grund wird vor anderen Bürgern geschützt, sofern du ihnen keinen Zugang gewährst.
286;Nahrung
287;Eine Nahrungsquelle zu finden ist entscheidend, um die Kalorien zu haben, die du zum Arbeiten benötigst. Darüber hinaus wirken sich die [Nutrition] der Lebensmittel, die du isst, darauf aus, wie schnell du Erfahrung sammelst. Daher möchtest du die besten verfügbaren Lebensmittel essen, um den schnellsten Fortschritt zu erzielen. Wenn du dich in der Wildnis niederlässt, suche Nahrungsquellen in der Nähe, oder plane die Einrichtung einer [Farm|Farming]. Wenn du dich in der Nähe eines bestehenden Dorfes niederlässt, schaue dir die lokale Wirtschaft an, um zu sehen, ob du [Trade] treiben kannst, um Nahrung zu erhalten.
288;Die Errichtung einer Nahrungsquelle und Unterkunft hat oberste Priorität. 
289;Das [Ecosystem|Ecosystem Overview] bietet eine Vielzahl von Ressourcen, die die Bürger nutzen können, ist aber auch anfällig für ihre Auswirkungen. Um als Gesellschaft erfolgreich zu sein, ist ein intelligentes Wirkungsmanagement erforderlich, bei dem mithilfe der [Government|Government Overview] geregelt wird, was zulässig ist.
 
Verschiedene Formen von [Pollution] können sich auf die Umwelt auswirken und das Potenzial für Katastrophen schaffen, die deine Nahrungsmittelversorgung zerstören und den Fortschritt stoppen können, was zu einem ökologischen Zusammenbruch führt. Mithilfe von [Data] -Mitteln können Bürger die Auswirkungen überwachen, die sie auf die Welt haben, und diese Daten verwenden, um spezifische Vorschriften zu bestreiten, um sie zu schützen, oder um die Wirtschaft auf anderen Wegen zu beschleunigen.

Die Welt beginnt als eine riesige unberührte Wildnis, und im Laufe der Zeit müssen die Bürger sie mithilfe von Technologie radikal verändern, um die Industrie und das Wissen aufzubauen, die erforderlich sind, um [The Meteor] zu stoppen. Die Bürger müssen sorgfältig zwischen der maximalen Nutzung der Ressourcen des Ökosystems und der Vermeidung von irreparablen Umweltschäden navigieren.

290;Das Ökosystem stellt viele Ressourcen zur Verfügung, ist aber anfällig für menschliches Handeln.
291;
  Eco ist eine Welt, die von zwei Bedrohungen heimgesucht wird: Der ökologische Kollaps und der immer näher rückende [Meteor|The Meteor].
  
Um erfolgreich zu sein, musst du im Laufe der Jahrhunderte Fortschritte machen und Wissenschaft und Industrie auf ein Niveau bringen, das den Meteor zerstören kann, ohne dabei einen ökologischen Zusammenbruch zu verursachen. Du tust dies als einzelnes Mitglied einer größeren Gesellschaft, und die Schaffung eines positiven Zusammenspiels zwischen individuellen Bedürfnissen und gesellschaftlichen Bedürfnissen ist entscheidend für den Erfolg.  

Dein Fokus in Eco wird darauf liegen, deinen individuellen Fortschritt zu verwalten und gleichzeitig daran zu arbeiten, die [Economy|Economy Overview] als Ganzes voranzutreiben, und dies in einem reichhaltigen [Ecosystem|Ecosystem Overview] von Pflanzen und Tieren, die von deinen Aktivitäten betroffen sind.  

Um eine positive Beziehung zwischen diesem Dreieck aus Individuen, Wirtschaft und Ökosystem herzustellen, stehen dir die Werkzeuge der [Government|Government Overview] zur Verfügung. Du kannst verbindliche [Laws] festlegen, die festlegen, was zulässig ist, und für [Election|Elections] kandidieren, um Regierungsbefugnisse zu erlangen, um Änderungen vorzunehmen und die Gesellschaft zu leiten.

 Aber zuerst musst du dich um deine Grundbedürfnisse kümmern, bevor du die Welt retten kannst. Dazu beginnst du mit [Food and Shelter].
292;Deine Reise in Eco.
293;Die Welt hat ein Ablaufdatum erhalten: ein Meteor in einer zusammenbrechenden Umlaufbahn um den Globus, der in 30 Echtzeit-Tagen kollidieren und dabei alles zerstören wird.  
  
Die Hoffnung ist jedoch nicht verloren, denn mit der richtigen Technologie kann diese Krise verhindert werden. Durch die Zusammenarbeit, um eine florierende [Economy|economy overview] zu generieren und Fortschritte der [Research] voranzutreiben, hat die Menschheit die Chance, den [Laser|LaserItem] aufzubauen, der zur Zerstörung dieser Bedrohung erforderlich ist.

Es wird keine leichte Aufgabe sein, und die Industrie, die erforderlich ist, um solche Fortschritte zu erzielen, wird eine echte Bedrohung für das [Ecosystem|Ecosystem Overview] darstellen. Um dies zu bekämpfen und nicht Opfer eines ökologischen Zusammenbruchs deiner eigenen Schöpfung zu werden, muss eine gut regulierte [Government|Government Overview] von ihren Bürgern entworfen, umgesetzt und geschaffen werden.

Das Schicksal der Welt hängt davon ab, dass ihre Bürger im Einklang mit dem Ökosystem zusammenarbeiten, um große technologische Leistungen zu erzielen, und nur durch eine studierte Zusammenarbeit können sie Erfolg haben.
  
294;Eine bedrohende Gefahr von oben.
295;Durch den Einsatz von Werkzeugen können die Bürger große Strukturen bauen und Berge versetzen. Mit den Startwerkzeugen kannst du nur kleine Änderungen vornehmen, aber mit fortschreitender Technologie erhältst du jedoch Werkzeuge, die Batchbetrieb durchführen können, und schließlich [Vehicle|Vehicle Component], die massive Veränderungen in der Welt bewirken können. 
296;Es stehen verschiedene Werkzeugtypen zur Verfügung:
  - [Building]-Werkzeuge. Mit Hämmern kannst du Baumaterialien in 'Formen' platzieren, mit Schaufeln kannst du den Boden bewegen.
  - [Farming]-Werkzeuge. Pflügen, Pflanzen und Säen verfügen alle über Werkzeuge, um ihre Effizienz zu steigern.
  - [Transport]-Werkzeuge. Fahrzeuge und Werkzeuge für den Straßenbau sind besonders nützlich für den Warentransport.
  - [Harvesting]-Werkzeuge. Diese Werkzeuge ermöglichen das Sammeln von Ressourcen aus dem Ökosystem.
  - [Hunting]-Werkzeuge. Die Jagd auf Tiere erfordert spezielle Werkzeuge.
  
Werkzeuge, die manuell angetrieben werden, benötigen Kalorien, was sich auf deine [Nutrition] auswirkt.
Allen Werkzeugen ist eine Haltbarkeit zugeordnet, die bei Verwendung abnimmt. Sobald ein Werkzeug seine Haltbarkeit verloren hat, benötigt es eine enorme Menge an Kalorien und sollte an einer [Repair|Repair Component]-Tisch repariert werden.
  
297;Der Zugang zu den besten Werkzeugen ermöglicht dir den schnellsten Fortschritt zu erzielen.
298;Nach dem Sammeln einiger grundlegender Rohstoffe ist das Bauen eines der ersten Dinge, die ein Bürger tun wird, um sich in der Welt zu etablieren.
  
  
299;Mit einem Hammer oder einem Kran können Bürger Gebäude für das Zuhause und die Industrie bauen.
300;
Mit der Meine-Urkunden-Komponente können Bürger alle [Property] anzeigen und verwalten, die sie besitzen, und eine Schnittstelle bereitstellen, über die sie problemlos darauf zugreifen können.
  
301;Ermöglicht es den Bürgern alle Grundstücke, die sie besitzen, zu sehen und zu verwalten.
302;
Die Text-Komponente befindet sich auf Schildern, [Vehicles|Vehicle Component] und der [Distribution Station|Item Distribution Component].
  
Text kann nützlich sein, um Anweisungen zu geben, zu werben oder einfach nur eine freundliche Begrüßung zu schreiben

Diejenigen, die mit Text-Markups vertraut sind, können verschiedene Tags verwenden, um die Größe, Farbe und Formatierung von Text zu ändern.

303;Ermöglicht Bürgern das Schreiben von Text, der anderen Bürgern angezeigt wird.
304;
